gen/measured_only_bert.json
{"i": [["[\"3ed6b8b696d74a428d188b1a05553246\", [1, 128, 3072], [1, 3072, 768], [1, 128, 768]]", "cuda -keys=cuda,gpu -arch=sm_89 -max_num_threads=1024 -max_shared_memory_per_block=49152 -max_threads_per_block=1024 -registers_per_block=65536 -thread_warp_size=32", [-1, 16, 64, 49152, 12345678, 1024, 8, 32], "", 0, []], [[], [["CHW", 2, "local"], ["SP", 2, 0, 1, [1, 1, 1, 1], 1], ["SP", 2, 5, 128, [1, 2, 8, 1], 1], ["SP", 2, 10, 768, [1, 32, 1, 24], 1], ["SP", 2, 15, 3072, [1, 1], 1], ["RE", 2, [0, 5, 10, 1, 6, 11, 2, 7, 12, 15, 16, 3, 8, 13, 17, 4, 9, 14]], ["FSP", 3, 0, 1, 3], ["FSP", 3, 4, 2, 3], ["FSP", 3, 8, 3, 3], ["RE", 3, [0, 4, 8, 1, 5, 9, 2, 6, 10, 3, 7, 11]], ["CA", 2, 3, 8], ["CHR", 1, "shared", [2]], ["CA", 2, 3, 9], ["CHR", 0, "shared", [3]], ["CA", 1, 4, 9], ["PPT"], ["SPC", 2, 0, 1, [1, 1, 1, 1], 1], ["SPC", 2, 5, 128, [1, 2, 8, 1], 1], ["SPC", 2, 10, 768, [1, 32, 1, 24], 1], ["SPC", 2, 15, 3072, [1, 1], 1], ["FU", 5, [0, 1, 2]], ["AN", 5, 0, 5], ["FU", 5, [1, 2, 3]], ["AN", 5, 1, 4], ["FU", 5, [2, 3, 4]], ["AN", 5, 2, 6], ["FU", 3, [0, 1, 2]], ["SP", 3, 0, 24, [1], 1], ["AN", 3, 1, 2], ["FFSP", 3, 0, [3, 2, 1], 1, 1], ["AN", 3, 1, 6], ["FU", 1, [0, 1, 2]], ["SP", 1, 0, 8, [2], 1], ["AN", 1, 1, 2], ["FFSP", 1, 0, [3, 2, 1], 1, 1], ["AN", 1, 1, 6], ["TBS"], ["SPC", 3, 0, 24, [1], 1], ["SPC", 1, 0, 8, [2], 1], ["PRS", [4]], ["PR", 4, 0, "auto_unroll_max_step$1024"]]]], "r": [[0.000941273], 0, 1.85435, 1763447609], "v": "v0.6"}
{"i": [["[\"3ed6b8b696d74a428d188b1a05553246\", [1, 128, 3072], [1, 3072, 768], [1, 128, 768]]", "cuda -keys=cuda,gpu -arch=sm_89 -max_num_threads=1024 -max_shared_memory_per_block=49152 -max_threads_per_block=1024 -registers_per_block=65536 -thread_warp_size=32", [-1, 16, 64, 49152, 12345678, 1024, 8, 32], "", 0, []], [[], [["CHW", 2, "local"], ["SP", 2, 0, 1, [1, 1, 1, 1], 1], ["SP", 2, 5, 128, [2, 1, 1, 2], 1], ["SP", 2, 10, 768, [1, 192, 1, 1], 1], ["SP", 2, 15, 3072, [1, 48], 1], ["RE", 2, [0, 5, 10, 1, 6, 11, 2, 7, 12, 15, 16, 3, 8, 13, 17, 4, 9, 14]], ["FSP", 3, 0, 1, 3], ["FSP", 3, 4, 2, 3], ["FSP", 3, 8, 3, 3], ["RE", 3, [0, 4, 8, 1, 5, 9, 2, 6, 10, 3, 7, 11]], ["CA", 2, 3, 8], ["CHR", 1, "shared", [2]], ["CA", 2, 3, 9], ["CHR", 0, "shared", [3]], ["CA", 1, 4, 9], ["PPT"], ["SPC", 2, 0, 1, [1, 1, 1, 1], 1], ["SPC", 2, 5, 128, [2, 1, 1, 2], 1], ["SPC", 2, 10, 768, [1, 192, 1, 1], 1], ["SPC", 2, 15, 3072, [1, 48], 1], ["FU", 5, [0, 1, 2]], ["AN", 5, 0, 5], ["FU", 5, [1, 2, 3]], ["AN", 5, 1, 4], ["FU", 5, [2, 3, 4]], ["AN", 5, 2, 6], ["FU", 3, [0, 1, 2]], ["SP", 3, 0, 48, [8], 1], ["AN", 3, 1, 2], ["FFSP", 3, 0, [3, 2, 1], 1, 1], ["AN", 3, 1, 6], ["FU", 1, [0, 1, 2]], ["SP", 1, 0, 96, [4], 1], ["AN", 1, 1, 2], ["FFSP", 1, 0, [3, 2, 1], 1, 1], ["AN", 1, 1, 6], ["TBS"], ["SPC", 3, 0, 48, [8], 1], ["SPC", 1, 0, 96, [4], 1], ["PRS", [4]], ["PR", 4, 0, "auto_unroll_max_step$16"]]]], "r": [[0.000106399], 0, 4.33509, 1763447610], "v": "v0.6"}
{"i": [["[\"3ed6b8b696d74a428d188b1a05553246\", [1, 128, 3072], [1, 3072, 768], [1, 128, 768]]", "cuda -keys=cuda,gpu -arch=sm_89 -max_num_threads=1024 -max_shared_memory_per_block=49152 -max_threads_per_block=1024 -registers_per_block=65536 -thread_warp_size=32", [-1, 16, 64, 49152, 12345678, 1024, 8, 32], "", 0, []], [[], [["CHW", 2, "local"], ["SP", 2, 0, 1, [1, 1, 1, 1], 1], ["SP", 2, 5, 128, [1, 2, 8, 1], 1], ["SP", 2, 10, 768, [6, 16, 1, 2], 1], ["SP", 2, 15, 3072, [2, 1], 1], ["RE", 2, [0, 5, 10, 1, 6, 11, 2, 7, 12, 15, 16, 3, 8, 13, 17, 4, 9, 14]], ["FSP", 3, 0, 1, 3], ["FSP", 3, 4, 2, 3], ["FSP", 3, 8, 3, 3], ["RE", 3, [0, 4, 8, 1, 5, 9, 2, 6, 10, 3, 7, 11]], ["CA", 2, 3, 8], ["CHR", 1, "shared", [2]], ["CA", 2, 3, 9], ["CHR", 0, "shared", [3]], ["CA", 1, 4, 9], ["PPT"], ["SPC", 2, 0, 1, [1, 1, 1, 1], 1], ["SPC", 2, 5, 128, [1, 2, 8, 1], 1], ["SPC", 2, 10, 768, [6, 16, 1, 2], 1], ["SPC", 2, 15, 3072, [2, 1], 1], ["FU", 5, [0, 1, 2]], ["AN", 5, 0, 5], ["FU", 5, [1, 2, 3]], ["AN", 5, 1, 4], ["FU", 5, [2, 3, 4]], ["AN", 5, 2, 6], ["FU", 3, [0, 1, 2]], ["SP", 3, 0, 4, [1], 1], ["AN", 3, 1, 2], ["FFSP", 3, 0, [3, 2, 1], 1, 1], ["AN", 3, 1, 6], ["FU", 1, [0, 1, 2]], ["SP", 1, 0, 16, [8], 1], ["AN", 1, 1, 2], ["FFSP", 1, 0, [3, 2, 1], 1, 1], ["AN", 1, 1, 6], ["TBS"], ["SPC", 3, 0, 4, [1], 1], ["SPC", 1, 0, 16, [8], 1], ["PRS", [4]], ["PR", 4, 0, "auto_unroll_max_step$1024"]]]], "r": [[0.00054417], 0, 1.72535, 1763447610], "v": "v0.6"}
{"i": [["[\"3ed6b8b696d74a428d188b1a05553246\", [1, 128, 3072], [1, 3072, 768], [1, 128, 768]]", "cuda -keys=cuda,gpu -arch=sm_89 -max_num_threads=1024 -max_shared_memory_per_block=49152 -max_threads_per_block=1024 -registers_per_block=65536 -thread_warp_size=32", [-1, 16, 64, 49152, 12345678, 1024, 8, 32], "", 0, []], [[], [["CHW", 2, "local"], ["SP", 2, 0, 1, [1, 1, 1, 1], 1], ["SP", 2, 5, 128, [1, 16, 2, 4], 1], ["SP", 2, 10, 768, [2, 8, 2, 1], 1], ["SP", 2, 15, 3072, [1, 2], 1], ["RE", 2, [0, 5, 10, 1, 6, 11, 2, 7, 12, 15, 16, 3, 8, 13, 17, 4, 9, 14]], ["FSP", 3, 0, 1, 3], ["FSP", 3, 4, 2, 3], ["FSP", 3, 8, 3, 3], ["RE", 3, [0, 4, 8, 1, 5, 9, 2, 6, 10, 3, 7, 11]], ["CA", 2, 3, 8], ["CHR", 1, "shared", [2]], ["CA", 2, 3, 9], ["CHR", 0, "shared", [3]], ["CA", 1, 4, 9], ["PPT"], ["SPC", 2, 0, 1, [1, 1, 1, 1], 1], ["SPC", 2, 5, 128, [1, 16, 2, 4], 1], ["SPC", 2, 10, 768, [2, 8, 2, 1], 1], ["SPC", 2, 15, 3072, [1, 2], 1], ["FU", 5, [0, 1, 2]], ["AN", 5, 0, 5], ["FU", 5, [1, 2, 3]], ["AN", 5, 1, 4], ["FU", 5, [2, 3, 4]], ["AN", 5, 2, 6], ["FU", 3, [0, 1, 2]], ["SP", 3, 0, 4, [2], 1], ["AN", 3, 1, 2], ["FFSP", 3, 0, [3, 2, 1], 1, 1], ["AN", 3, 1, 6], ["FU", 1, [0, 1, 2]], ["SP", 1, 0, 16, [2], 1], ["AN", 1, 1, 2], ["FFSP", 1, 0, [3, 2, 1], 1, 1], ["AN", 1, 1, 6], ["TBS"], ["SPC", 3, 0, 4, [2], 1], ["SPC", 1, 0, 16, [2], 1], ["PRS", [4]], ["PR", 4, 0, "auto_unroll_max_step$1024"]]]], "r": [[0.000355323], 0, 1.58407, 1763447611], "v": "v0.6"}
{"i": [["[\"3ed6b8b696d74a428d188b1a05553246\", [1, 128, 3072], [1, 3072, 768], [1, 128, 768]]", "cuda -keys=cuda,gpu -arch=sm_89 -max_num_threads=1024 -max_shared_memory_per_block=49152 -max_threads_per_block=1024 -registers_per_block=65536 -thread_warp_size=32", [-1, 16, 64, 49152, 12345678, 1024, 8, 32], "", 0, []], [[], [["CHW", 2, "local"], ["SP", 2, 0, 1, [1, 1, 1, 1], 1], ["SP", 2, 5, 128, [1, 4, 1, 1], 1], ["SP", 2, 10, 768, [1, 8, 1, 1], 1], ["SP", 2, 15, 3072, [1, 96], 1], ["RE", 2, [0, 5, 10, 1, 6, 11, 2, 7, 12, 15, 16, 3, 8, 13, 17, 4, 9, 14]], ["FSP", 3, 0, 1, 3], ["FSP", 3, 4, 2, 3], ["FSP", 3, 8, 3, 3], ["RE", 3, [0, 4, 8, 1, 5, 9, 2, 6, 10, 3, 7, 11]], ["CA", 2, 3, 8], ["CHR", 1, "shared", [2]], ["CA", 2, 3, 9], ["CHR", 0, "shared", [3]], ["CA", 1, 4, 9], ["PPT"], ["SPC", 2, 0, 1, [1, 1, 1, 1], 1], ["SPC", 2, 5, 128, [1, 4, 1, 1], 1], ["SPC", 2, 10, 768, [1, 8, 1, 1], 1], ["SPC", 2, 15, 3072, [1, 96], 1], ["FU", 5, [0, 1, 2]], ["AN", 5, 0, 5], ["FU", 5, [1, 2, 3]], ["AN", 5, 1, 4], ["FU", 5, [2, 3, 4]], ["AN", 5, 2, 6], ["FU", 3, [0, 1, 2]], ["SP", 3, 0, 96, [16], 1], ["AN", 3, 1, 2], ["FFSP", 3, 0, [3, 2, 1], 1, 1], ["AN", 3, 1, 6], ["FU", 1, [0, 1, 2]], ["SP", 1, 0, 96, [2], 1], ["AN", 1, 1, 2], ["FFSP", 1, 0, [3, 2, 1], 1, 1], ["AN", 1, 1, 6], ["TBS"], ["SPC", 3, 0, 96, [16], 1], ["SPC", 1, 0, 96, [2], 1], ["PRS", [4]], ["PR", 4, 0, "auto_unroll_max_step$64"]]]], "r": [[0.00034854], 0, 1.50131, 1763447612], "v": "v0.6"}
{"i": [["[\"3ed6b8b696d74a428d188b1a05553246\", [1, 128, 3072], [1, 3072, 768], [1, 128, 768]]", "cuda -keys=cuda,gpu -arch=sm_89 -max_num_threads=1024 -max_shared_memory_per_block=49152 -max_threads_per_block=1024 -registers_per_block=65536 -thread_warp_size=32", [-1, 16, 64, 49152, 12345678, 1024, 8, 32], "", 0, []], [[], [["CHW", 2, "local"], ["SP", 2, 0, 1, [1, 1, 1, 1], 1], ["SP", 2, 5, 128, [1, 16, 2, 1], 1], ["SP", 2, 10, 768, [2, 4, 1, 2], 1], ["SP", 2, 15, 3072, [1, 24], 1], ["RE", 2, [0, 5, 10, 1, 6, 11, 2, 7, 12, 15, 16, 3, 8, 13, 17, 4, 9, 14]], ["FSP", 3, 0, 1, 3], ["FSP", 3, 4, 2, 3], ["FSP", 3, 8, 3, 3], ["RE", 3, [0, 4, 8, 1, 5, 9, 2, 6, 10, 3, 7, 11]], ["CA", 2, 3, 8], ["CHR", 1, "shared", [2]], ["CA", 2, 3, 9], ["CHR", 0, "shared", [3]], ["CA", 1, 4, 9], ["PPT"], ["SPC", 2, 0, 1, [1, 1, 1, 1], 1], ["SPC", 2, 5, 128, [1, 16, 2, 1], 1], ["SPC", 2, 10, 768, [2, 4, 1, 2], 1], ["SPC", 2, 15, 3072, [1, 24], 1], ["FU", 5, [0, 1, 2]], ["AN", 5, 0, 5], ["FU", 5, [1, 2, 3]], ["AN", 5, 1, 4], ["FU", 5, [2, 3, 4]], ["AN", 5, 2, 6], ["FU", 3, [0, 1, 2]], ["SP", 3, 0, 48, [4], 1], ["AN", 3, 1, 2], ["FFSP", 3, 0, [3, 2, 1], 1, 1], ["AN", 3, 1, 6], ["FU", 1, [0, 1, 2]], ["SP", 1, 0, 48, [1], 1], ["AN", 1, 1, 2], ["FFSP", 1, 0, [3, 2, 1], 1, 1], ["AN", 1, 1, 6], ["TBS"], ["SPC", 3, 0, 48, [4], 1], ["SPC", 1, 0, 48, [1], 1], ["PRS", [4]], ["PR", 4, 0, "auto_unroll_max_step$16"]]]], "r": [[0.000119452], 0, 1.4743, 1763447613], "v": "v0.6"}
{"i": [["[\"3ed6b8b696d74a428d188b1a05553246\", [1, 128, 3072], [1, 3072, 768], [1, 128, 768]]", "cuda -keys=cuda,gpu -arch=sm_89 -max_num_threads=1024 -max_shared_memory_per_block=49152 -max_threads_per_block=1024 -registers_per_block=65536 -thread_warp_size=32", [-1, 16, 64, 49152, 12345678, 1024, 8, 32], "", 0, []], [[], [["CHW", 2, "local"], ["SP", 2, 0, 1, [1, 1, 1, 1], 1], ["SP", 2, 5, 128, [4, 8, 2, 1], 1], ["SP", 2, 10, 768, [1, 32, 2, 4], 1], ["SP", 2, 15, 3072, [1, 2], 1], ["RE", 2, [0, 5, 10, 1, 6, 11, 2, 7, 12, 15, 16, 3, 8, 13, 17, 4, 9, 14]], ["FSP", 3, 0, 1, 3], ["FSP", 3, 4, 2, 3], ["FSP", 3, 8, 3, 3], ["RE", 3, [0, 4, 8, 1, 5, 9, 2, 6, 10, 3, 7, 11]], ["CA", 2, 3, 8], ["CHR", 1, "shared", [2]], ["CA", 2, 3, 9], ["CHR", 0, "shared", [3]], ["CA", 1, 4, 9], ["PPT"], ["SPC", 2, 0, 1, [1, 1, 1, 1], 1], ["SPC", 2, 5, 128, [4, 8, 2, 1], 1], ["SPC", 2, 10, 768, [1, 32, 2, 4], 1], ["SPC", 2, 15, 3072, [1, 2], 1], ["FU", 5, [0, 1, 2]], ["AN", 5, 0, 5], ["FU", 5, [1, 2, 3]], ["AN", 5, 1, 4], ["FU", 5, [2, 3, 4]], ["AN", 5, 2, 6], ["FU", 3, [0, 1, 2]], ["SP", 3, 0, 16, [8], 1], ["AN", 3, 1, 2], ["FFSP", 3, 0, [3, 2, 1], 1, 1], ["AN", 3, 1, 6], ["FU", 1, [0, 1, 2]], ["SP", 1, 0, 4, [2], 1], ["AN", 1, 1, 2], ["FFSP", 1, 0, [3, 2, 1], 1, 1], ["AN", 1, 1, 6], ["TBS"], ["SPC", 3, 0, 16, [8], 1], ["SPC", 1, 0, 4, [2], 1], ["PRS", [4]], ["PR", 4, 0, "auto_unroll_max_step$512"]]]], "r": [[0.000563169], 0, 1.73574, 1763447614], "v": "v0.6"}
{"i": [["[\"3ed6b8b696d74a428d188b1a05553246\", [1, 128, 3072], [1, 3072, 768], [1, 128, 768]]", "cuda -keys=cuda,gpu -arch=sm_89 -max_num_threads=1024 -max_shared_memory_per_block=49152 -max_threads_per_block=1024 -registers_per_block=65536 -thread_warp_size=32", [-1, 16, 64, 49152, 12345678, 1024, 8, 32], "", 0, []], [[], [["CHW", 2, "local"], ["SP", 2, 0, 1, [1, 1, 1, 1], 1], ["SP", 2, 5, 128, [4, 2, 1, 2], 1], ["SP", 2, 10, 768, [1, 32, 2, 2], 1], ["SP", 2, 15, 3072, [1, 6], 1], ["RE", 2, [0, 5, 10, 1, 6, 11, 2, 7, 12, 15, 16, 3, 8, 13, 17, 4, 9, 14]], ["FSP", 3, 0, 1, 3], ["FSP", 3, 4, 2, 3], ["FSP", 3, 8, 3, 3], ["RE", 3, [0, 4, 8, 1, 5, 9, 2, 6, 10, 3, 7, 11]], ["CA", 2, 3, 8], ["CHR", 1, "shared", [2]], ["CA", 2, 3, 9], ["CHR", 0, "shared", [3]], ["CA", 1, 4, 9], ["PPT"], ["SPC", 2, 0, 1, [1, 1, 1, 1], 1], ["SPC", 2, 5, 128, [4, 2, 1, 2], 1], ["SPC", 2, 10, 768, [1, 32, 2, 2], 1], ["SPC", 2, 15, 3072, [1, 6], 1], ["FU", 5, [0, 1, 2]], ["AN", 5, 0, 5], ["FU", 5, [1, 2, 3]], ["AN", 5, 1, 4], ["FU", 5, [2, 3, 4]], ["AN", 5, 2, 6], ["FU", 3, [0, 1, 2]], ["SP", 3, 0, 24, [2], 1], ["AN", 3, 1, 2], ["FFSP", 3, 0, [3, 2, 1], 1, 1], ["AN", 3, 1, 6], ["FU", 1, [0, 1, 2]], ["SP", 1, 0, 12, [1], 1], ["AN", 1, 1, 2], ["FFSP", 1, 0, [3, 2, 1], 1, 1], ["AN", 1, 1, 6], ["TBS"], ["SPC", 3, 0, 24, [2], 1], ["SPC", 1, 0, 12, [1], 1], ["PRS", [4]], ["PR", 4, 0, "auto_unroll_max_step$0"]]]], "r": [[0.000163198], 0, 1.51003, 1763447615], "v": "v0.6"}
{"i": [["[\"3ed6b8b696d74a428d188b1a05553246\", [1, 128, 3072], [1, 3072, 768], [1, 128, 768]]", "cuda -keys=cuda,gpu -arch=sm_89 -max_num_threads=1024 -max_shared_memory_per_block=49152 -max_threads_per_block=1024 -registers_per_block=65536 -thread_warp_size=32", [-1, 16, 64, 49152, 12345678, 1024, 8, 32], "", 0, []], [[], [["CHW", 2, "local"], ["SP", 2, 0, 1, [1, 1, 1, 1], 1], ["SP", 2, 5, 128, [1, 1, 2, 16], 1], ["SP", 2, 10, 768, [1, 32, 1, 4], 1], ["SP", 2, 15, 3072, [1, 4], 1], ["RE", 2, [0, 5, 10, 1, 6, 11, 2, 7, 12, 15, 16, 3, 8, 13, 17, 4, 9, 14]], ["FSP", 3, 0, 1, 3], ["FSP", 3, 4, 2, 3], ["FSP", 3, 8, 3, 3], ["RE", 3, [0, 4, 8, 1, 5, 9, 2, 6, 10, 3, 7, 11]], ["CA", 2, 3, 8], ["CHR", 1, "shared", [2]], ["CA", 2, 3, 9], ["CHR", 0, "shared", [3]], ["CA", 1, 4, 9], ["PPT"], ["SPC", 2, 0, 1, [1, 1, 1, 1], 1], ["SPC", 2, 5, 128, [1, 1, 2, 16], 1], ["SPC", 2, 10, 768, [1, 32, 1, 4], 1], ["SPC", 2, 15, 3072, [1, 4], 1], ["FU", 5, [0, 1, 2]], ["AN", 5, 0, 5], ["FU", 5, [1, 2, 3]], ["AN", 5, 1, 4], ["FU", 5, [2, 3, 4]], ["AN", 5, 2, 6], ["FU", 3, [0, 1, 2]], ["SP", 3, 0, 16, [4], 1], ["AN", 3, 1, 2], ["FFSP", 3, 0, [3, 2, 1], 1, 1], ["AN", 3, 1, 6], ["FU", 1, [0, 1, 2]], ["SP", 1, 0, 128, [2], 1], ["AN", 1, 1, 2], ["FFSP", 1, 0, [3, 2, 1], 1, 1], ["AN", 1, 1, 6], ["TBS"], ["SPC", 3, 0, 16, [4], 1], ["SPC", 1, 0, 128, [2], 1], ["PRS", [4]], ["PR", 4, 0, "auto_unroll_max_step$512"]]]], "r": [[0.000400191], 0, 1.96578, 1763447616], "v": "v0.6"}
{"i": [["[\"3ed6b8b696d74a428d188b1a05553246\", [1, 128, 3072], [1, 3072, 768], [1, 128, 768]]", "cuda -keys=cuda,gpu -arch=sm_89 -max_num_threads=1024 -max_shared_memory_per_block=49152 -max_threads_per_block=1024 -registers_per_block=65536 -thread_warp_size=32", [-1, 16, 64, 49152, 12345678, 1024, 8, 32], "", 0, []], [[], [["CHW", 2, "local"], ["SP", 2, 0, 1, [1, 1, 1, 1], 1], ["SP", 2, 5, 128, [1, 4, 4, 8], 1], ["SP", 2, 10, 768, [2, 16, 4, 2], 1], ["SP", 2, 15, 3072, [1, 3], 1], ["RE", 2, [0, 5, 10, 1, 6, 11, 2, 7, 12, 15, 16, 3, 8, 13, 17, 4, 9, 14]], ["FSP", 3, 0, 1, 3], ["FSP", 3, 4, 2, 3], ["FSP", 3, 8, 3, 3], ["RE", 3, [0, 4, 8, 1, 5, 9, 2, 6, 10, 3, 7, 11]], ["CA", 2, 3, 8], ["CHR", 1, "shared", [2]], ["CA", 2, 3, 9], ["CHR", 0, "shared", [3]], ["CA", 1, 4, 9], ["PPT"], ["SPC", 2, 0, 1, [1, 1, 1, 1], 1], ["SPC", 2, 5, 128, [1, 4, 4, 8], 1], ["SPC", 2, 10, 768, [2, 16, 4, 2], 1], ["SPC", 2, 15, 3072, [1, 3], 1], ["FU", 5, [0, 1, 2]], ["AN", 5, 0, 5], ["FU", 5, [1, 2, 3]], ["AN", 5, 1, 4], ["FU", 5, [2, 3, 4]], ["AN", 5, 2, 6], ["FU", 3, [0, 1, 2]], ["SP", 3, 0, 24, [3], 1], ["AN", 3, 1, 2], ["FFSP", 3, 0, [3, 2, 1], 1, 1], ["AN", 3, 1, 6], ["FU", 1, [0, 1, 2]], ["SP", 1, 0, 96, [1], 1], ["AN", 1, 1, 2], ["FFSP", 1, 0, [3, 2, 1], 1, 1], ["AN", 1, 1, 6], ["TBS"], ["SPC", 3, 0, 24, [3], 1], ["SPC", 1, 0, 96, [1], 1], ["PRS", [4]], ["PR", 4, 0, "auto_unroll_max_step$0"]]]], "r": [[0.00387062], 0, 1.54913, 1763447617], "v": "v0.6"}
{"i": [["[\"3ed6b8b696d74a428d188b1a05553246\", [1, 128, 3072], [1, 3072, 768], [1, 128, 768]]", "cuda -keys=cuda,gpu -arch=sm_89 -max_num_threads=1024 -max_shared_memory_per_block=49152 -max_threads_per_block=1024 -registers_per_block=65536 -thread_warp_size=32", [-1, 16, 64, 49152, 12345678, 1024, 8, 32], "", 0, []], [[], [["CHW", 2, "local"], ["SP", 2, 0, 1, [1, 1, 1, 1], 1], ["SP", 2, 5, 128, [1, 1, 1, 4], 1], ["SP", 2, 10, 768, [1, 768, 1, 1], 1], ["SP", 2, 15, 3072, [1, 4], 1], ["RE", 2, [0, 5, 10, 1, 6, 11, 2, 7, 12, 15, 16, 3, 8, 13, 17, 4, 9, 14]], ["FSP", 3, 0, 1, 3], ["FSP", 3, 4, 2, 3], ["FSP", 3, 8, 3, 3], ["RE", 3, [0, 4, 8, 1, 5, 9, 2, 6, 10, 3, 7, 11]], ["CA", 2, 3, 8], ["CHR", 1, "shared", [2]], ["CA", 2, 3, 9], ["CHR", 0, "shared", [3]], ["CA", 1, 4, 9], ["PPT"], ["SPC", 2, 0, 1, [1, 1, 1, 1], 1], ["SPC", 2, 5, 128, [1, 1, 1, 4], 1], ["SPC", 2, 10, 768, [1, 768, 1, 1], 1], ["SPC", 2, 15, 3072, [1, 4], 1], ["FU", 5, [0, 1, 2]], ["AN", 5, 0, 5], ["FU", 5, [1, 2, 3]], ["AN", 5, 1, 4], ["FU", 5, [2, 3, 4]], ["AN", 5, 2, 6], ["FU", 3, [0, 1, 2]], ["SP", 3, 0, 4, [2], 1], ["AN", 3, 1, 2], ["FFSP", 3, 0, [3, 2, 1], 1, 1], ["AN", 3, 1, 6], ["FU", 1, [0, 1, 2]], ["SP", 1, 0, 16, [4], 1], ["AN", 1, 1, 2], ["FFSP", 1, 0, [3, 2, 1], 1, 1], ["AN", 1, 1, 6], ["TBS"], ["SPC", 3, 0, 4, [2], 1], ["SPC", 1, 0, 16, [4], 1], ["PRS", [4]], ["PR", 4, 0, "auto_unroll_max_step$16"]]]], "r": [[0.000288931], 0, 1.47115, 1763447618], "v": "v0.6"}
{"i": [["[\"3ed6b8b696d74a428d188b1a05553246\", [1, 128, 3072], [1, 3072, 768], [1, 128, 768]]", "cuda -keys=cuda,gpu -arch=sm_89 -max_num_threads=1024 -max_shared_memory_per_block=49152 -max_threads_per_block=1024 -registers_per_block=65536 -thread_warp_size=32", [-1, 16, 64, 49152, 12345678, 1024, 8, 32], "", 0, []], [[], [["CHW", 2, "local"], ["SP", 2, 0, 1, [1, 1, 1, 1], 1], ["SP", 2, 5, 128, [1, 4, 1, 1], 1], ["SP", 2, 10, 768, [1, 16, 2, 2], 1], ["SP", 2, 15, 3072, [1, 48], 1], ["RE", 2, [0, 5, 10, 1, 6, 11, 2, 7, 12, 15, 16, 3, 8, 13, 17, 4, 9, 14]], ["FSP", 3, 0, 1, 3], ["FSP", 3, 4, 2, 3], ["FSP", 3, 8, 3, 3], ["RE", 3, [0, 4, 8, 1, 5, 9, 2, 6, 10, 3, 7, 11]], ["CA", 2, 3, 8], ["CHR", 1, "shared", [2]], ["CA", 2, 3, 9], ["CHR", 0, "shared", [3]], ["CA", 1, 4, 9], ["PPT"], ["SPC", 2, 0, 1, [1, 1, 1, 1], 1], ["SPC", 2, 5, 128, [1, 4, 1, 1], 1], ["SPC", 2, 10, 768, [1, 16, 2, 2], 1], ["SPC", 2, 15, 3072, [1, 48], 1], ["FU", 5, [0, 1, 2]], ["AN", 5, 0, 5], ["FU", 5, [1, 2, 3]], ["AN", 5, 1, 4], ["FU", 5, [2, 3, 4]], ["AN", 5, 2, 6], ["FU", 3, [0, 1, 2]], ["SP", 3, 0, 192, [1], 1], ["AN", 3, 1, 2], ["FFSP", 3, 0, [3, 2, 1], 1, 1], ["AN", 3, 1, 6], ["FU", 1, [0, 1, 2]], ["SP", 1, 0, 48, [6], 1], ["AN", 1, 1, 2], ["FFSP", 1, 0, [3, 2, 1], 1, 1], ["AN", 1, 1, 6], ["TBS"], ["SPC", 3, 0, 192, [1], 1], ["SPC", 1, 0, 48, [6], 1], ["PRS", [4]], ["PR", 4, 0, "auto_unroll_max_step$0"]]]], "r": [[9.27538e-05], 0, 1.59769, 1763447618], "v": "v0.6"}
{"i": [["[\"3ed6b8b696d74a428d188b1a05553246\", [1, 128, 3072], [1, 3072, 768], [1, 128, 768]]", "cuda -keys=cuda,gpu -arch=sm_89 -max_num_threads=1024 -max_shared_memory_per_block=49152 -max_threads_per_block=1024 -registers_per_block=65536 -thread_warp_size=32", [-1, 16, 64, 49152, 12345678, 1024, 8, 32], "", 0, []], [[], [["CHW", 2, "local"], ["SP", 2, 0, 1, [1, 1, 1, 1], 1], ["SP", 2, 5, 128, [2, 4, 1, 4], 1], ["SP", 2, 10, 768, [1, 8, 1, 4], 1], ["SP", 2, 15, 3072, [1, 96], 1], ["RE", 2, [0, 5, 10, 1, 6, 11, 2, 7, 12, 15, 16, 3, 8, 13, 17, 4, 9, 14]], ["FSP", 3, 0, 1, 3], ["FSP", 3, 4, 2, 3], ["FSP", 3, 8, 3, 3], ["RE", 3, [0, 4, 8, 1, 5, 9, 2, 6, 10, 3, 7, 11]], ["CA", 2, 3, 8], ["CHR", 1, "shared", [2]], ["CA", 2, 3, 9], ["CHR", 0, "shared", [3]], ["CA", 1, 4, 9], ["PPT"], ["SPC", 2, 0, 1, [1, 1, 1, 1], 1], ["SPC", 2, 5, 128, [2, 4, 1, 4], 1], ["SPC", 2, 10, 768, [1, 8, 1, 4], 1], ["SPC", 2, 15, 3072, [1, 96], 1], ["FU", 5, [0, 1, 2]], ["AN", 5, 0, 5], ["FU", 5, [1, 2, 3]], ["AN", 5, 1, 4], ["FU", 5, [2, 3, 4]], ["AN", 5, 2, 6], ["FU", 3, [0, 1, 2]], ["SP", 3, 0, 384, [1], 1], ["AN", 3, 1, 2], ["FFSP", 3, 0, [3, 2, 1], 1, 1], ["AN", 3, 1, 6], ["FU", 1, [0, 1, 2]], ["SP", 1, 0, 384, [6], 1], ["AN", 1, 1, 2], ["FFSP", 1, 0, [3, 2, 1], 1, 1], ["AN", 1, 1, 6], ["TBS"], ["SPC", 3, 0, 384, [1], 1], ["SPC", 1, 0, 384, [6], 1], ["PRS", [4]], ["PR", 4, 0, "auto_unroll_max_step$0"]]]], "r": [[0.000110336], 0, 1.58947, 1763447620], "v": "v0.6"}
{"i": [["[\"3ed6b8b696d74a428d188b1a05553246\", [1, 128, 3072], [1, 3072, 768], [1, 128, 768]]", "cuda -keys=cuda,gpu -arch=sm_89 -max_num_threads=1024 -max_shared_memory_per_block=49152 -max_threads_per_block=1024 -registers_per_block=65536 -thread_warp_size=32", [-1, 16, 64, 49152, 12345678, 1024, 8, 32], "", 0, []], [[], [["CHW", 2, "local"], ["SP", 2, 0, 1, [1, 1, 1, 1], 1], ["SP", 2, 5, 128, [1, 1, 2, 4], 1], ["SP", 2, 10, 768, [1, 32, 1, 1], 1], ["SP", 2, 15, 3072, [1, 48], 1], ["RE", 2, [0, 5, 10, 1, 6, 11, 2, 7, 12, 15, 16, 3, 8, 13, 17, 4, 9, 14]], ["FSP", 3, 0, 1, 3], ["FSP", 3, 4, 2, 3], ["FSP", 3, 8, 3, 3], ["RE", 3, [0, 4, 8, 1, 5, 9, 2, 6, 10, 3, 7, 11]], ["CA", 2, 3, 8], ["CHR", 1, "shared", [2]], ["CA", 2, 3, 9], ["CHR", 0, "shared", [3]], ["CA", 1, 4, 9], ["PPT"], ["SPC", 2, 0, 1, [1, 1, 1, 1], 1], ["SPC", 2, 5, 128, [1, 1, 2, 4], 1], ["SPC", 2, 10, 768, [1, 32, 1, 1], 1], ["SPC", 2, 15, 3072, [1, 48], 1], ["FU", 5, [0, 1, 2]], ["AN", 5, 0, 5], ["FU", 5, [1, 2, 3]], ["AN", 5, 1, 4], ["FU", 5, [2, 3, 4]], ["AN", 5, 2, 6], ["FU", 3, [0, 1, 2]], ["SP", 3, 0, 48, [2], 1], ["AN", 3, 1, 2], ["FFSP", 3, 0, [3, 2, 1], 1, 1], ["AN", 3, 1, 6], ["FU", 1, [0, 1, 2]], ["SP", 1, 0, 384, [1], 1], ["AN", 1, 1, 2], ["FFSP", 1, 0, [3, 2, 1], 1, 1], ["AN", 1, 1, 6], ["TBS"], ["SPC", 3, 0, 48, [2], 1], ["SPC", 1, 0, 384, [1], 1], ["PRS", [4]], ["PR", 4, 0, "auto_unroll_max_step$1024"]]]], "r": [[5.71381e-05], 0, 1.99649, 1763447620], "v": "v0.6"}
{"i": [["[\"3ed6b8b696d74a428d188b1a05553246\", [1, 128, 3072], [1, 3072, 768], [1, 128, 768]]", "cuda -keys=cuda,gpu -arch=sm_89 -max_num_threads=1024 -max_shared_memory_per_block=49152 -max_threads_per_block=1024 -registers_per_block=65536 -thread_warp_size=32", [-1, 16, 64, 49152, 12345678, 1024, 8, 32], "", 0, []], [[], [["CHW", 2, "local"], ["SP", 2, 0, 1, [1, 1, 1, 1], 1], ["SP", 2, 5, 128, [1, 1, 4, 4], 1], ["SP", 2, 10, 768, [1, 96, 1, 1], 1], ["SP", 2, 15, 3072, [4, 2], 1], ["RE", 2, [0, 5, 10, 1, 6, 11, 2, 7, 12, 15, 16, 3, 8, 13, 17, 4, 9, 14]], ["FSP", 3, 0, 1, 3], ["FSP", 3, 4, 2, 3], ["FSP", 3, 8, 3, 3], ["RE", 3, [0, 4, 8, 1, 5, 9, 2, 6, 10, 3, 7, 11]], ["CA", 2, 3, 8], ["CHR", 1, "shared", [2]], ["CA", 2, 3, 9], ["CHR", 0, "shared", [3]], ["CA", 1, 4, 9], ["PPT"], ["SPC", 2, 0, 1, [1, 1, 1, 1], 1], ["SPC", 2, 5, 128, [1, 1, 4, 4], 1], ["SPC", 2, 10, 768, [1, 96, 1, 1], 1], ["SPC", 2, 15, 3072, [4, 2], 1], ["FU", 5, [0, 1, 2]], ["AN", 5, 0, 5], ["FU", 5, [1, 2, 3]], ["AN", 5, 1, 4], ["FU", 5, [2, 3, 4]], ["AN", 5, 2, 6], ["FU", 3, [0, 1, 2]], ["SP", 3, 0, 8, [2], 1], ["AN", 3, 1, 2], ["FFSP", 3, 0, [3, 2, 1], 1, 1], ["AN", 3, 1, 6], ["FU", 1, [0, 1, 2]], ["SP", 1, 0, 128, [1], 1], ["AN", 1, 1, 2], ["FFSP", 1, 0, [3, 2, 1], 1, 1], ["AN", 1, 1, 6], ["TBS"], ["SPC", 3, 0, 8, [2], 1], ["SPC", 1, 0, 128, [1], 1], ["PRS", [4]], ["PR", 4, 0, "auto_unroll_max_step$16"]]]], "r": [[0.000159147], 0, 1.45844, 1763447621], "v": "v0.6"}
{"i": [["[\"3ed6b8b696d74a428d188b1a05553246\", [1, 128, 3072], [1, 3072, 768], [1, 128, 768]]", "cuda -keys=cuda,gpu -arch=sm_89 -max_num_threads=1024 -max_shared_memory_per_block=49152 -max_threads_per_block=1024 -registers_per_block=65536 -thread_warp_size=32", [-1, 16, 64, 49152, 12345678, 1024, 8, 32], "", 0, []], [[], [["CHW", 2, "local"], ["SP", 2, 0, 1, [1, 1, 1, 1], 1], ["SP", 2, 5, 128, [1, 1, 1, 4], 1], ["SP", 2, 10, 768, [1, 48, 1, 2], 1], ["SP", 2, 15, 3072, [1, 4], 1], ["RE", 2, [0, 5, 10, 1, 6, 11, 2, 7, 12, 15, 16, 3, 8, 13, 17, 4, 9, 14]], ["FSP", 3, 0, 1, 3], ["FSP", 3, 4, 2, 3], ["FSP", 3, 8, 3, 3], ["RE", 3, [0, 4, 8, 1, 5, 9, 2, 6, 10, 3, 7, 11]], ["CA", 2, 3, 8], ["CHR", 1, "shared", [2]], ["CA", 2, 3, 9], ["CHR", 0, "shared", [3]], ["CA", 1, 4, 9], ["PPT"], ["SPC", 2, 0, 1, [1, 1, 1, 1], 1], ["SPC", 2, 5, 128, [1, 1, 1, 4], 1], ["SPC", 2, 10, 768, [1, 48, 1, 2], 1], ["SPC", 2, 15, 3072, [1, 4], 1], ["FU", 5, [0, 1, 2]], ["AN", 5, 0, 5], ["FU", 5, [1, 2, 3]], ["AN", 5, 1, 4], ["FU", 5, [2, 3, 4]], ["AN", 5, 2, 6], ["FU", 3, [0, 1, 2]], ["SP", 3, 0, 8, [1], 1], ["AN", 3, 1, 2], ["FFSP", 3, 0, [3, 2, 1], 1, 1], ["AN", 3, 1, 6], ["FU", 1, [0, 1, 2]], ["SP", 1, 0, 16, [2], 1], ["AN", 1, 1, 2], ["FFSP", 1, 0, [3, 2, 1], 1, 1], ["AN", 1, 1, 6], ["TBS"], ["SPC", 3, 0, 8, [1], 1], ["SPC", 1, 0, 16, [2], 1], ["PRS", [4]], ["PR", 4, 0, "auto_unroll_max_step$512"]]]], "r": [[0.000157655], 0, 1.66393, 1763447622], "v": "v0.6"}
{"i": [["[\"3ed6b8b696d74a428d188b1a05553246\", [1, 128, 3072], [1, 3072, 768], [1, 128, 768]]", "cuda -keys=cuda,gpu -arch=sm_89 -max_num_threads=1024 -max_shared_memory_per_block=49152 -max_threads_per_block=1024 -registers_per_block=65536 -thread_warp_size=32", [-1, 16, 64, 49152, 12345678, 1024, 8, 32], "", 0, []], [[], [["CHW", 2, "local"], ["SP", 2, 0, 1, [1, 1, 1, 1], 1], ["SP", 2, 5, 128, [1, 16, 2, 1], 1], ["SP", 2, 10, 768, [1, 4, 1, 1], 1], ["SP", 2, 15, 3072, [1, 48], 1], ["RE", 2, [0, 5, 10, 1, 6, 11, 2, 7, 12, 15, 16, 3, 8, 13, 17, 4, 9, 14]], ["FSP", 3, 0, 1, 3], ["FSP", 3, 4, 2, 3], ["FSP", 3, 8, 3, 3], ["RE", 3, [0, 4, 8, 1, 5, 9, 2, 6, 10, 3, 7, 11]], ["CA", 2, 3, 8], ["CHR", 1, "shared", [2]], ["CA", 2, 3, 9], ["CHR", 0, "shared", [3]], ["CA", 1, 4, 9], ["PPT"], ["SPC", 2, 0, 1, [1, 1, 1, 1], 1], ["SPC", 2, 5, 128, [1, 16, 2, 1], 1], ["SPC", 2, 10, 768, [1, 4, 1, 1], 1], ["SPC", 2, 15, 3072, [1, 48], 1], ["FU", 5, [0, 1, 2]], ["AN", 5, 0, 5], ["FU", 5, [1, 2, 3]], ["AN", 5, 1, 4], ["FU", 5, [2, 3, 4]], ["AN", 5, 2, 6], ["FU", 3, [0, 1, 2]], ["SP", 3, 0, 48, [2], 1], ["AN", 3, 1, 2], ["FFSP", 3, 0, [3, 2, 1], 1, 1], ["AN", 3, 1, 6], ["FU", 1, [0, 1, 2]], ["SP", 1, 0, 96, [1], 1], ["AN", 1, 1, 2], ["FFSP", 1, 0, [3, 2, 1], 1, 1], ["AN", 1, 1, 6], ["TBS"], ["SPC", 3, 0, 48, [2], 1], ["SPC", 1, 0, 96, [1], 1], ["PRS", [4]], ["PR", 4, 0, "auto_unroll_max_step$512"]]]], "r": [[0.000116403], 0, 1.64488, 1763447623], "v": "v0.6"}
{"i": [["[\"3ed6b8b696d74a428d188b1a05553246\", [1, 128, 3072], [1, 3072, 768], [1, 128, 768]]", "cuda -keys=cuda,gpu -arch=sm_89 -max_num_threads=1024 -max_shared_memory_per_block=49152 -max_threads_per_block=1024 -registers_per_block=65536 -thread_warp_size=32", [-1, 16, 64, 49152, 12345678, 1024, 8, 32], "", 0, []], [[], [["CHW", 2, "local"], ["SP", 2, 0, 1, [1, 1, 1, 1], 1], ["SP", 2, 5, 128, [1, 1, 2, 64], 1], ["SP", 2, 10, 768, [1, 32, 2, 3], 1], ["SP", 2, 15, 3072, [1, 16], 1], ["RE", 2, [0, 5, 10, 1, 6, 11, 2, 7, 12, 15, 16, 3, 8, 13, 17, 4, 9, 14]], ["FSP", 3, 0, 1, 3], ["FSP", 3, 4, 2, 3], ["FSP", 3, 8, 3, 3], ["RE", 3, [0, 4, 8, 1, 5, 9, 2, 6, 10, 3, 7, 11]], ["CA", 2, 3, 8], ["CHR", 1, "shared", [2]], ["CA", 2, 3, 9], ["CHR", 0, "shared", [3]], ["CA", 1, 4, 9], ["PPT"], ["SPC", 2, 0, 1, [1, 1, 1, 1], 1], ["SPC", 2, 5, 128, [1, 1, 2, 64], 1], ["SPC", 2, 10, 768, [1, 32, 2, 3], 1], ["SPC", 2, 15, 3072, [1, 16], 1], ["FU", 5, [0, 1, 2]], ["AN", 5, 0, 5], ["FU", 5, [1, 2, 3]], ["AN", 5, 1, 4], ["FU", 5, [2, 3, 4]], ["AN", 5, 2, 6], ["FU", 3, [0, 1, 2]], ["SP", 3, 0, 96, [4], 1], ["AN", 3, 1, 2], ["FFSP", 3, 0, [3, 2, 1], 1, 1], ["AN", 3, 1, 6], ["FU", 1, [0, 1, 2]], ["SP", 1, 0, 2048, [2], 1], ["AN", 1, 1, 2], ["FFSP", 1, 0, [3, 2, 1], 1, 1], ["AN", 1, 1, 6], ["TBS"], ["SPC", 3, 0, 96, [4], 1], ["SPC", 1, 0, 2048, [2], 1], ["PRS", [4]], ["PR", 4, 0, "auto_unroll_max_step$16"]]]], "r": [[0.00601455], 0, 3.04497, 1763447624], "v": "v0.6"}
{"i": [["[\"3ed6b8b696d74a428d188b1a05553246\", [1, 128, 3072], [1, 3072, 768], [1, 128, 768]]", "cuda -keys=cuda,gpu -arch=sm_89 -max_num_threads=1024 -max_shared_memory_per_block=49152 -max_threads_per_block=1024 -registers_per_block=65536 -thread_warp_size=32", [-1, 16, 64, 49152, 12345678, 1024, 8, 32], "", 0, []], [[], [["CHW", 2, "local"], ["SP", 2, 0, 1, [1, 1, 1, 1], 1], ["SP", 2, 5, 128, [1, 16, 1, 1], 1], ["SP", 2, 10, 768, [1, 4, 1, 2], 1], ["SP", 2, 15, 3072, [1, 2], 1], ["RE", 2, [0, 5, 10, 1, 6, 11, 2, 7, 12, 15, 16, 3, 8, 13, 17, 4, 9, 14]], ["FSP", 3, 0, 1, 3], ["FSP", 3, 4, 2, 3], ["FSP", 3, 8, 3, 3], ["RE", 3, [0, 4, 8, 1, 5, 9, 2, 6, 10, 3, 7, 11]], ["CA", 2, 3, 8], ["CHR", 1, "shared", [2]], ["CA", 2, 3, 9], ["CHR", 0, "shared", [3]], ["CA", 1, 4, 9], ["PPT"], ["SPC", 2, 0, 1, [1, 1, 1, 1], 1], ["SPC", 2, 5, 128, [1, 16, 1, 1], 1], ["SPC", 2, 10, 768, [1, 4, 1, 2], 1], ["SPC", 2, 15, 3072, [1, 2], 1], ["FU", 5, [0, 1, 2]], ["AN", 5, 0, 5], ["FU", 5, [1, 2, 3]], ["AN", 5, 1, 4], ["FU", 5, [2, 3, 4]], ["AN", 5, 2, 6], ["FU", 3, [0, 1, 2]], ["SP", 3, 0, 4, [1], 1], ["AN", 3, 1, 2], ["FFSP", 3, 0, [3, 2, 1], 1, 1], ["AN", 3, 1, 6], ["FU", 1, [0, 1, 2]], ["SP", 1, 0, 2, [1], 1], ["AN", 1, 1, 2], ["FFSP", 1, 0, [3, 2, 1], 1, 1], ["AN", 1, 1, 6], ["TBS"], ["SPC", 3, 0, 4, [1], 1], ["SPC", 1, 0, 2, [1], 1], ["PRS", [4]], ["PR", 4, 0, "auto_unroll_max_step$512"]]]], "r": [[0.000165986], 0, 1.44964, 1763447625], "v": "v0.6"}
{"i": [["[\"3ed6b8b696d74a428d188b1a05553246\", [1, 128, 3072], [1, 3072, 768], [1, 128, 768]]", "cuda -keys=cuda,gpu -arch=sm_89 -max_num_threads=1024 -max_shared_memory_per_block=49152 -max_threads_per_block=1024 -registers_per_block=65536 -thread_warp_size=32", [-1, 16, 64, 49152, 12345678, 1024, 8, 32], "", 0, []], [[], [["CHW", 2, "local"], ["SP", 2, 0, 1, [1, 1, 1, 1], 1], ["SP", 2, 5, 128, [1, 32, 2, 1], 1], ["SP", 2, 10, 768, [1, 2, 1, 24], 1], ["SP", 2, 15, 3072, [4, 5], 1], ["RE", 2, [0, 5, 10, 1, 6, 11, 2, 7, 12, 15, 16, 3, 8, 13, 17, 4, 9, 14]], ["FSP", 3, 0, 1, 3], ["FSP", 3, 4, 2, 3], ["FSP", 3, 8, 3, 3], ["RE", 3, [0, 4, 8, 1, 5, 9, 2, 6, 10, 3, 7, 11]], ["CA", 2, 3, 8], ["CHR", 1, "shared", [2]], ["CA", 2, 3, 9], ["CHR", 0, "shared", [3]], ["CA", 1, 4, 9], ["PPT"], ["SPC", 2, 0, 1, [1, 1, 1, 1], 1], ["SPC", 2, 5, 128, [1, 32, 2, 1], 1], ["SPC", 2, 10, 768, [1, 2, 1, 24], 1], ["SPC", 2, 15, 3072, [4, 5], 1], ["FU", 5, [0, 1, 2]], ["AN", 5, 0, 5], ["FU", 5, [1, 2, 3]], ["AN", 5, 1, 4], ["FU", 5, [2, 3, 4]], ["AN", 5, 2, 6], ["FU", 3, [0, 1, 2]], ["SP", 3, 0, 480, [2], 1], ["AN", 3, 1, 2], ["FFSP", 3, 0, [3, 2, 1], 1, 1], ["AN", 3, 1, 6], ["FU", 1, [0, 1, 2]], ["SP", 1, 0, 40, [2], 1], ["AN", 1, 1, 2], ["FFSP", 1, 0, [3, 2, 1], 1, 1], ["AN", 1, 1, 6], ["TBS"], ["SPC", 3, 0, 480, [2], 1], ["SPC", 1, 0, 40, [2], 1], ["PRS", [4]], ["PR", 4, 0, "auto_unroll_max_step$16"]]]], "r": [[0.000304846], 0, 1.91857, 1763447626], "v": "v0.6"}
{"i": [["[\"3ed6b8b696d74a428d188b1a05553246\", [1, 128, 3072], [1, 3072, 768], [1, 128, 768]]", "cuda -keys=cuda,gpu -arch=sm_89 -max_num_threads=1024 -max_shared_memory_per_block=49152 -max_threads_per_block=1024 -registers_per_block=65536 -thread_warp_size=32", [-1, 16, 64, 49152, 12345678, 1024, 8, 32], "", 0, []], [[], [["CHW", 2, "local"], ["SP", 2, 0, 1, [1, 1, 1, 1], 1], ["SP", 2, 5, 128, [2, 32, 2, 1], 1], ["SP", 2, 10, 768, [4, 1, 1, 2], 1], ["SP", 2, 15, 3072, [1, 32], 1], ["RE", 2, [0, 5, 10, 1, 6, 11, 2, 7, 12, 15, 16, 3, 8, 13, 17, 4, 9, 14]], ["FSP", 3, 0, 1, 3], ["FSP", 3, 4, 2, 3], ["FSP", 3, 8, 3, 3], ["RE", 3, [0, 4, 8, 1, 5, 9, 2, 6, 10, 3, 7, 11]], ["CA", 2, 3, 8], ["CHR", 1, "shared", [2]], ["CA", 2, 3, 9], ["CHR", 0, "shared", [3]], ["CA", 1, 4, 9], ["PPT"], ["SPC", 2, 0, 1, [1, 1, 1, 1], 1], ["SPC", 2, 5, 128, [2, 32, 2, 1], 1], ["SPC", 2, 10, 768, [4, 1, 1, 2], 1], ["SPC", 2, 15, 3072, [1, 32], 1], ["FU", 5, [0, 1, 2]], ["AN", 5, 0, 5], ["FU", 5, [1, 2, 3]], ["AN", 5, 1, 4], ["FU", 5, [2, 3, 4]], ["AN", 5, 2, 6], ["FU", 3, [0, 1, 2]], ["SP", 3, 0, 64, [1], 1], ["AN", 3, 1, 2], ["FFSP", 3, 0, [3, 2, 1], 1, 1], ["AN", 3, 1, 6], ["FU", 1, [0, 1, 2]], ["SP", 1, 0, 64, [2], 1], ["AN", 1, 1, 2], ["FFSP", 1, 0, [3, 2, 1], 1, 1], ["AN", 1, 1, 6], ["TBS"], ["SPC", 3, 0, 64, [1], 1], ["SPC", 1, 0, 64, [2], 1], ["PRS", [4]], ["PR", 4, 0, "auto_unroll_max_step$0"]]]], "r": [[0.00036495], 0, 1.61549, 1763447627], "v": "v0.6"}
{"i": [["[\"3ed6b8b696d74a428d188b1a05553246\", [1, 128, 3072], [1, 3072, 768], [1, 128, 768]]", "cuda -keys=cuda,gpu -arch=sm_89 -max_num_threads=1024 -max_shared_memory_per_block=49152 -max_threads_per_block=1024 -registers_per_block=65536 -thread_warp_size=32", [-1, 16, 64, 49152, 12345678, 1024, 8, 32], "", 0, []], [[], [["CHW", 2, "local"], ["SP", 2, 0, 1, [1, 1, 1, 1], 1], ["SP", 2, 5, 128, [2, 32, 1, 2], 1], ["SP", 2, 10, 768, [2, 2, 1, 1], 1], ["SP", 2, 15, 3072, [1, 4], 1], ["RE", 2, [0, 5, 10, 1, 6, 11, 2, 7, 12, 15, 16, 3, 8, 13, 17, 4, 9, 14]], ["FSP", 3, 0, 1, 3], ["FSP", 3, 4, 2, 3], ["FSP", 3, 8, 3, 3], ["RE", 3, [0, 4, 8, 1, 5, 9, 2, 6, 10, 3, 7, 11]], ["CA", 2, 3, 8], ["CHR", 1, "shared", [2]], ["CA", 2, 3, 9], ["CHR", 0, "shared", [3]], ["CA", 1, 4, 9], ["PPT"], ["SPC", 2, 0, 1, [1, 1, 1, 1], 1], ["SPC", 2, 5, 128, [2, 32, 1, 2], 1], ["SPC", 2, 10, 768, [2, 2, 1, 1], 1], ["SPC", 2, 15, 3072, [1, 4], 1], ["FU", 5, [0, 1, 2]], ["AN", 5, 0, 5], ["FU", 5, [1, 2, 3]], ["AN", 5, 1, 4], ["FU", 5, [2, 3, 4]], ["AN", 5, 2, 6], ["FU", 3, [0, 1, 2]], ["SP", 3, 0, 4, [2], 1], ["AN", 3, 1, 2], ["FFSP", 3, 0, [3, 2, 1], 1, 1], ["AN", 3, 1, 6], ["FU", 1, [0, 1, 2]], ["SP", 1, 0, 8, [2], 1], ["AN", 1, 1, 2], ["FFSP", 1, 0, [3, 2, 1], 1, 1], ["AN", 1, 1, 6], ["TBS"], ["SPC", 3, 0, 4, [2], 1], ["SPC", 1, 0, 8, [2], 1], ["PRS", [4]], ["PR", 4, 0, "auto_unroll_max_step$1024"]]]], "r": [[0.000220783], 0, 1.48768, 1763447628], "v": "v0.6"}
{"i": [["[\"3ed6b8b696d74a428d188b1a05553246\", [1, 128, 3072], [1, 3072, 768], [1, 128, 768]]", "cuda -keys=cuda,gpu -arch=sm_89 -max_num_threads=1024 -max_shared_memory_per_block=49152 -max_threads_per_block=1024 -registers_per_block=65536 -thread_warp_size=32", [-1, 16, 64, 49152, 12345678, 1024, 8, 32], "", 0, []], [[], [["CHW", 2, "local"], ["SP", 2, 0, 1, [1, 1, 1, 1], 1], ["SP", 2, 5, 128, [2, 4, 1, 1], 1], ["SP", 2, 10, 768, [1, 8, 1, 2], 1], ["SP", 2, 15, 3072, [4, 3], 1], ["RE", 2, [0, 5, 10, 1, 6, 11, 2, 7, 12, 15, 16, 3, 8, 13, 17, 4, 9, 14]], ["FSP", 3, 0, 1, 3], ["FSP", 3, 4, 2, 3], ["FSP", 3, 8, 3, 3], ["RE", 3, [0, 4, 8, 1, 5, 9, 2, 6, 10, 3, 7, 11]], ["CA", 2, 3, 8], ["CHR", 1, "shared", [2]], ["CA", 2, 3, 9], ["CHR", 0, "shared", [3]], ["CA", 1, 4, 9], ["PPT"], ["SPC", 2, 0, 1, [1, 1, 1, 1], 1], ["SPC", 2, 5, 128, [2, 4, 1, 1], 1], ["SPC", 2, 10, 768, [1, 8, 1, 2], 1], ["SPC", 2, 15, 3072, [4, 3], 1], ["FU", 5, [0, 1, 2]], ["AN", 5, 0, 5], ["FU", 5, [1, 2, 3]], ["AN", 5, 1, 4], ["FU", 5, [2, 3, 4]], ["AN", 5, 2, 6], ["FU", 3, [0, 1, 2]], ["SP", 3, 0, 24, [1], 1], ["AN", 3, 1, 2], ["FFSP", 3, 0, [3, 2, 1], 1, 1], ["AN", 3, 1, 6], ["FU", 1, [0, 1, 2]], ["SP", 1, 0, 12, [2], 1], ["AN", 1, 1, 2], ["FFSP", 1, 0, [3, 2, 1], 1, 1], ["AN", 1, 1, 6], ["TBS"], ["SPC", 3, 0, 24, [1], 1], ["SPC", 1, 0, 12, [2], 1], ["PRS", [4]], ["PR", 4, 0, "auto_unroll_max_step$1024"]]]], "r": [[6.31817e-05], 0, 1.45768, 1763447628], "v": "v0.6"}
{"i": [["[\"3ed6b8b696d74a428d188b1a05553246\", [1, 128, 3072], [1, 3072, 768], [1, 128, 768]]", "cuda -keys=cuda,gpu -arch=sm_89 -max_num_threads=1024 -max_shared_memory_per_block=49152 -max_threads_per_block=1024 -registers_per_block=65536 -thread_warp_size=32", [-1, 16, 64, 49152, 12345678, 1024, 8, 32], "", 0, []], [[], [["CHW", 2, "local"], ["SP", 2, 0, 1, [1, 1, 1, 1], 1], ["SP", 2, 5, 128, [1, 8, 1, 8], 1], ["SP", 2, 10, 768, [1, 48, 1, 1], 1], ["SP", 2, 15, 3072, [1, 4], 1], ["RE", 2, [0, 5, 10, 1, 6, 11, 2, 7, 12, 15, 16, 3, 8, 13, 17, 4, 9, 14]], ["FSP", 3, 0, 1, 3], ["FSP", 3, 4, 2, 3], ["FSP", 3, 8, 3, 3], ["RE", 3, [0, 4, 8, 1, 5, 9, 2, 6, 10, 3, 7, 11]], ["CA", 2, 3, 8], ["CHR", 1, "shared", [2]], ["CA", 2, 3, 9], ["CHR", 0, "shared", [3]], ["CA", 1, 4, 9], ["PPT"], ["SPC", 2, 0, 1, [1, 1, 1, 1], 1], ["SPC", 2, 5, 128, [1, 8, 1, 8], 1], ["SPC", 2, 10, 768, [1, 48, 1, 1], 1], ["SPC", 2, 15, 3072, [1, 4], 1], ["FU", 5, [0, 1, 2]], ["AN", 5, 0, 5], ["FU", 5, [1, 2, 3]], ["AN", 5, 1, 4], ["FU", 5, [2, 3, 4]], ["AN", 5, 2, 6], ["FU", 3, [0, 1, 2]], ["SP", 3, 0, 4, [1], 1], ["AN", 3, 1, 2], ["FFSP", 3, 0, [3, 2, 1], 1, 1], ["AN", 3, 1, 6], ["FU", 1, [0, 1, 2]], ["SP", 1, 0, 32, [1], 1], ["AN", 1, 1, 2], ["FFSP", 1, 0, [3, 2, 1], 1, 1], ["AN", 1, 1, 6], ["TBS"], ["SPC", 3, 0, 4, [1], 1], ["SPC", 1, 0, 32, [1], 1], ["PRS", [4]], ["PR", 4, 0, "auto_unroll_max_step$16"]]]], "r": [[0.000228743], 0, 1.44606, 1763447629], "v": "v0.6"}
{"i": [["[\"3ed6b8b696d74a428d188b1a05553246\", [1, 128, 3072], [1, 3072, 768], [1, 128, 768]]", "cuda -keys=cuda,gpu -arch=sm_89 -max_num_threads=1024 -max_shared_memory_per_block=49152 -max_threads_per_block=1024 -registers_per_block=65536 -thread_warp_size=32", [-1, 16, 64, 49152, 12345678, 1024, 8, 32], "", 0, []], [[], [["CHW", 2, "local"], ["SP", 2, 0, 1, [1, 1, 1, 1], 1], ["SP", 2, 5, 128, [1, 32, 1, 4], 1], ["SP", 2, 10, 768, [1, 1, 1, 96], 1], ["SP", 2, 15, 3072, [1, 32], 1], ["RE", 2, [0, 5, 10, 1, 6, 11, 2, 7, 12, 15, 16, 3, 8, 13, 17, 4, 9, 14]], ["FSP", 3, 0, 1, 3], ["FSP", 3, 4, 2, 3], ["FSP", 3, 8, 3, 3], ["RE", 3, [0, 4, 8, 1, 5, 9, 2, 6, 10, 3, 7, 11]], ["CA", 2, 3, 8], ["CHR", 1, "shared", [2]], ["CA", 2, 3, 9], ["CHR", 0, "shared", [3]], ["CA", 1, 4, 9], ["PPT"], ["SPC", 2, 0, 1, [1, 1, 1, 1], 1], ["SPC", 2, 5, 128, [1, 32, 1, 4], 1], ["SPC", 2, 10, 768, [1, 1, 1, 96], 1], ["SPC", 2, 15, 3072, [1, 32], 1], ["FU", 5, [0, 1, 2]], ["AN", 5, 0, 5], ["FU", 5, [1, 2, 3]], ["AN", 5, 1, 4], ["FU", 5, [2, 3, 4]], ["AN", 5, 2, 6], ["FU", 3, [0, 1, 2]], ["SP", 3, 0, 3072, [1], 1], ["AN", 3, 1, 2], ["FFSP", 3, 0, [3, 2, 1], 1, 1], ["AN", 3, 1, 6], ["FU", 1, [0, 1, 2]], ["SP", 1, 0, 128, [1], 1], ["AN", 1, 1, 2], ["FFSP", 1, 0, [3, 2, 1], 1, 1], ["AN", 1, 1, 6], ["TBS"], ["SPC", 3, 0, 3072, [1], 1], ["SPC", 1, 0, 128, [1], 1], ["PRS", [4]], ["PR", 4, 0, "auto_unroll_max_step$64"]]]], "r": [[0.00562203], 0, 1.54121, 1763447630], "v": "v0.6"}
{"i": [["[\"3ed6b8b696d74a428d188b1a05553246\", [1, 128, 3072], [1, 3072, 768], [1, 128, 768]]", "cuda -keys=cuda,gpu -arch=sm_89 -max_num_threads=1024 -max_shared_memory_per_block=49152 -max_threads_per_block=1024 -registers_per_block=65536 -thread_warp_size=32", [-1, 16, 64, 49152, 12345678, 1024, 8, 32], "", 0, []], [[], [["CHW", 2, "local"], ["SP", 2, 0, 1, [1, 1, 1, 1], 1], ["SP", 2, 5, 128, [1, 8, 1, 4], 1], ["SP", 2, 10, 768, [1, 12, 8, 1], 1], ["SP", 2, 15, 3072, [4, 1], 1], ["RE", 2, [0, 5, 10, 1, 6, 11, 2, 7, 12, 15, 16, 3, 8, 13, 17, 4, 9, 14]], ["FSP", 3, 0, 1, 3], ["FSP", 3, 4, 2, 3], ["FSP", 3, 8, 3, 3], ["RE", 3, [0, 4, 8, 1, 5, 9, 2, 6, 10, 3, 7, 11]], ["CA", 2, 3, 8], ["CHR", 1, "shared", [2]], ["CA", 2, 3, 9], ["CHR", 0, "shared", [3]], ["CA", 1, 4, 9], ["PPT"], ["SPC", 2, 0, 1, [1, 1, 1, 1], 1], ["SPC", 2, 5, 128, [1, 8, 1, 4], 1], ["SPC", 2, 10, 768, [1, 12, 8, 1], 1], ["SPC", 2, 15, 3072, [4, 1], 1], ["FU", 5, [0, 1, 2]], ["AN", 5, 0, 5], ["FU", 5, [1, 2, 3]], ["AN", 5, 1, 4], ["FU", 5, [2, 3, 4]], ["AN", 5, 2, 6], ["FU", 3, [0, 1, 2]], ["SP", 3, 0, 32, [4], 1], ["AN", 3, 1, 2], ["FFSP", 3, 0, [3, 2, 1], 1, 1], ["AN", 3, 1, 6], ["FU", 1, [0, 1, 2]], ["SP", 1, 0, 16, [2], 1], ["AN", 1, 1, 2], ["FFSP", 1, 0, [3, 2, 1], 1, 1], ["AN", 1, 1, 6], ["TBS"], ["SPC", 3, 0, 32, [4], 1], ["SPC", 1, 0, 16, [2], 1], ["PRS", [4]], ["PR", 4, 0, "auto_unroll_max_step$64"]]]], "r": [[0.00021683], 0, 1.50382, 1763447631], "v": "v0.6"}
{"i": [["[\"3ed6b8b696d74a428d188b1a05553246\", [1, 128, 3072], [1, 3072, 768], [1, 128, 768]]", "cuda -keys=cuda,gpu -arch=sm_89 -max_num_threads=1024 -max_shared_memory_per_block=49152 -max_threads_per_block=1024 -registers_per_block=65536 -thread_warp_size=32", [-1, 16, 64, 49152, 12345678, 1024, 8, 32], "", 0, []], [[], [["CHW", 2, "local"], ["SP", 2, 0, 1, [1, 1, 1, 1], 1], ["SP", 2, 5, 128, [1, 64, 1, 2], 1], ["SP", 2, 10, 768, [4, 1, 1, 1], 1], ["SP", 2, 15, 3072, [1, 1], 1], ["RE", 2, [0, 5, 10, 1, 6, 11, 2, 7, 12, 15, 16, 3, 8, 13, 17, 4, 9, 14]], ["FSP", 3, 0, 1, 3], ["FSP", 3, 4, 2, 3], ["FSP", 3, 8, 3, 3], ["RE", 3, [0, 4, 8, 1, 5, 9, 2, 6, 10, 3, 7, 11]], ["CA", 2, 3, 8], ["CHR", 1, "shared", [2]], ["CA", 2, 3, 9], ["CHR", 0, "shared", [3]], ["CA", 1, 4, 9], ["PPT"], ["SPC", 2, 0, 1, [1, 1, 1, 1], 1], ["SPC", 2, 5, 128, [1, 64, 1, 2], 1], ["SPC", 2, 10, 768, [4, 1, 1, 1], 1], ["SPC", 2, 15, 3072, [1, 1], 1], ["FU", 5, [0, 1, 2]], ["AN", 5, 0, 5], ["FU", 5, [1, 2, 3]], ["AN", 5, 1, 4], ["FU", 5, [2, 3, 4]], ["AN", 5, 2, 6], ["FU", 3, [0, 1, 2]], ["SP", 3, 0, 1, [1], 1], ["AN", 3, 1, 2], ["FFSP", 3, 0, [3, 2, 1], 1, 1], ["AN", 3, 1, 6], ["FU", 1, [0, 1, 2]], ["SP", 1, 0, 2, [2], 1], ["AN", 1, 1, 2], ["FFSP", 1, 0, [3, 2, 1], 1, 1], ["AN", 1, 1, 6], ["TBS"], ["SPC", 3, 0, 1, [1], 1], ["SPC", 1, 0, 2, [2], 1], ["PRS", [4]], ["PR", 4, 0, "auto_unroll_max_step$16"]]]], "r": [[0.000447395], 0, 1.45337, 1763447632], "v": "v0.6"}
{"i": [["[\"3ed6b8b696d74a428d188b1a05553246\", [1, 128, 768], [1, 768, 3072], [1, 128, 3072]]", "cuda -keys=cuda,gpu -arch=sm_89 -max_num_threads=1024 -max_shared_memory_per_block=49152 -max_threads_per_block=1024 -registers_per_block=65536 -thread_warp_size=32", [-1, 16, 64, 49152, 12345678, 1024, 8, 32], "", 0, []], [[], [["CHW", 2, "local"], ["SP", 2, 0, 1, [1, 1, 1, 1], 1], ["SP", 2, 5, 128, [1, 4, 1, 2], 1], ["SP", 2, 10, 3072, [1, 64, 3, 2], 1], ["SP", 2, 15, 768, [1, 16], 1], ["RE", 2, [0, 5, 10, 1, 6, 11, 2, 7, 12, 15, 16, 3, 8, 13, 17, 4, 9, 14]], ["FSP", 3, 0, 1, 3], ["FSP", 3, 4, 2, 3], ["FSP", 3, 8, 3, 3], ["RE", 3, [0, 4, 8, 1, 5, 9, 2, 6, 10, 3, 7, 11]], ["CA", 2, 3, 8], ["CHR", 1, "shared", [2]], ["CA", 2, 3, 9], ["CHR", 0, "shared", [3]], ["CA", 1, 4, 9], ["PPT"], ["SPC", 2, 0, 1, [1, 1, 1, 1], 1], ["SPC", 2, 5, 128, [1, 4, 1, 2], 1], ["SPC", 2, 10, 3072, [1, 64, 3, 2], 1], ["SPC", 2, 15, 768, [1, 16], 1], ["FU", 5, [0, 1, 2]], ["AN", 5, 0, 5], ["FU", 5, [1, 2, 3]], ["AN", 5, 1, 4], ["FU", 5, [2, 3, 4]], ["AN", 5, 2, 6], ["FU", 3, [0, 1, 2]], ["SP", 3, 0, 96, [3], 1], ["AN", 3, 1, 2], ["FFSP", 3, 0, [3, 2, 1], 1, 1], ["AN", 3, 1, 6], ["FU", 1, [0, 1, 2]], ["SP", 1, 0, 32, [1], 1], ["AN", 1, 1, 2], ["FFSP", 1, 0, [3, 2, 1], 1, 1], ["AN", 1, 1, 6], ["TBS"], ["SPC", 3, 0, 96, [3], 1], ["SPC", 1, 0, 32, [1], 1], ["PRS", [4]], ["PR", 4, 0, "auto_unroll_max_step$512"]]]], "r": [[5.31713e-05], 0, 1.74819, 1763447664], "v": "v0.6"}
{"i": [["[\"3ed6b8b696d74a428d188b1a05553246\", [1, 128, 768], [1, 768, 3072], [1, 128, 3072]]", "cuda -keys=cuda,gpu -arch=sm_89 -max_num_threads=1024 -max_shared_memory_per_block=49152 -max_threads_per_block=1024 -registers_per_block=65536 -thread_warp_size=32", [-1, 16, 64, 49152, 12345678, 1024, 8, 32], "", 0, []], [[], [["CHW", 2, "local"], ["SP", 2, 0, 1, [1, 1, 1, 1], 1], ["SP", 2, 5, 128, [2, 16, 1, 4], 1], ["SP", 2, 10, 3072, [2, 6, 8, 1], 1], ["SP", 2, 15, 768, [1, 24], 1], ["RE", 2, [0, 5, 10, 1, 6, 11, 2, 7, 12, 15, 16, 3, 8, 13, 17, 4, 9, 14]], ["FSP", 3, 0, 1, 3], ["FSP", 3, 4, 2, 3], ["FSP", 3, 8, 3, 3], ["RE", 3, [0, 4, 8, 1, 5, 9, 2, 6, 10, 3, 7, 11]], ["CA", 2, 3, 8], ["CHR", 1, "shared", [2]], ["CA", 2, 3, 9], ["CHR", 0, "shared", [3]], ["CA", 1, 4, 9], ["PPT"], ["SPC", 2, 0, 1, [1, 1, 1, 1], 1], ["SPC", 2, 5, 128, [2, 16, 1, 4], 1], ["SPC", 2, 10, 3072, [2, 6, 8, 1], 1], ["SPC", 2, 15, 768, [1, 24], 1], ["FU", 5, [0, 1, 2]], ["AN", 5, 0, 5], ["FU", 5, [1, 2, 3]], ["AN", 5, 1, 4], ["FU", 5, [2, 3, 4]], ["AN", 5, 2, 6], ["FU", 3, [0, 1, 2]], ["SP", 3, 0, 192, [1], 1], ["AN", 3, 1, 2], ["FFSP", 3, 0, [3, 2, 1], 1, 1], ["AN", 3, 1, 6], ["FU", 1, [0, 1, 2]], ["SP", 1, 0, 96, [1], 1], ["AN", 1, 1, 2], ["FFSP", 1, 0, [3, 2, 1], 1, 1], ["AN", 1, 1, 6], ["TBS"], ["SPC", 3, 0, 192, [1], 1], ["SPC", 1, 0, 96, [1], 1], ["PRS", [4]], ["PR", 4, 0, "auto_unroll_max_step$0"]]]], "r": [[0.00016066], 0, 1.70805, 1763447664], "v": "v0.6"}
{"i": [["[\"3ed6b8b696d74a428d188b1a05553246\", [1, 128, 768], [1, 768, 3072], [1, 128, 3072]]", "cuda -keys=cuda,gpu -arch=sm_89 -max_num_threads=1024 -max_shared_memory_per_block=49152 -max_threads_per_block=1024 -registers_per_block=65536 -thread_warp_size=32", [-1, 16, 64, 49152, 12345678, 1024, 8, 32], "", 0, []], [[], [["CHW", 2, "local"], ["SP", 2, 0, 1, [1, 1, 1, 1], 1], ["SP", 2, 5, 128, [2, 8, 1, 1], 1], ["SP", 2, 10, 3072, [2, 8, 1, 1], 1], ["SP", 2, 15, 768, [2, 1], 1], ["RE", 2, [0, 5, 10, 1, 6, 11, 2, 7, 12, 15, 16, 3, 8, 13, 17, 4, 9, 14]], ["FSP", 3, 0, 1, 3], ["FSP", 3, 4, 2, 3], ["FSP", 3, 8, 3, 3], ["RE", 3, [0, 4, 8, 1, 5, 9, 2, 6, 10, 3, 7, 11]], ["CA", 2, 3, 8], ["CHR", 1, "shared", [2]], ["CA", 2, 3, 9], ["CHR", 0, "shared", [3]], ["CA", 1, 4, 9], ["PPT"], ["SPC", 2, 0, 1, [1, 1, 1, 1], 1], ["SPC", 2, 5, 128, [2, 8, 1, 1], 1], ["SPC", 2, 10, 3072, [2, 8, 1, 1], 1], ["SPC", 2, 15, 768, [2, 1], 1], ["FU", 5, [0, 1, 2]], ["AN", 5, 0, 5], ["FU", 5, [1, 2, 3]], ["AN", 5, 1, 4], ["FU", 5, [2, 3, 4]], ["AN", 5, 2, 6], ["FU", 3, [0, 1, 2]], ["SP", 3, 0, 2, [2], 1], ["AN", 3, 1, 2], ["FFSP", 3, 0, [3, 2, 1], 1, 1], ["AN", 3, 1, 6], ["FU", 1, [0, 1, 2]], ["SP", 1, 0, 2, [2], 1], ["AN", 1, 1, 2], ["FFSP", 1, 0, [3, 2, 1], 1, 1], ["AN", 1, 1, 6], ["TBS"], ["SPC", 3, 0, 2, [2], 1], ["SPC", 1, 0, 2, [2], 1], ["PRS", [4]], ["PR", 4, 0, "auto_unroll_max_step$16"]]]], "r": [[0.000107526], 0, 0.940599, 1763447665], "v": "v0.6"}
{"i": [["[\"3ed6b8b696d74a428d188b1a05553246\", [1, 128, 768], [1, 768, 3072], [1, 128, 3072]]", "cuda -keys=cuda,gpu -arch=sm_89 -max_num_threads=1024 -max_shared_memory_per_block=49152 -max_threads_per_block=1024 -registers_per_block=65536 -thread_warp_size=32", [-1, 16, 64, 49152, 12345678, 1024, 8, 32], "", 0, []], [[], [["CHW", 2, "local"], ["SP", 2, 0, 1, [1, 1, 1, 1], 1], ["SP", 2, 5, 128, [1, 8, 1, 2], 1], ["SP", 2, 10, 3072, [1, 16, 1, 16], 1], ["SP", 2, 15, 768, [3, 2], 1], ["RE", 2, [0, 5, 10, 1, 6, 11, 2, 7, 12, 15, 16, 3, 8, 13, 17, 4, 9, 14]], ["FSP", 3, 0, 1, 3], ["FSP", 3, 4, 2, 3], ["FSP", 3, 8, 3, 3], ["RE", 3, [0, 4, 8, 1, 5, 9, 2, 6, 10, 3, 7, 11]], ["CA", 2, 3, 8], ["CHR", 1, "shared", [2]], ["CA", 2, 3, 9], ["CHR", 0, "shared", [3]], ["CA", 1, 4, 9], ["PPT"], ["SPC", 2, 0, 1, [1, 1, 1, 1], 1], ["SPC", 2, 5, 128, [1, 8, 1, 2], 1], ["SPC", 2, 10, 3072, [1, 16, 1, 16], 1], ["SPC", 2, 15, 768, [3, 2], 1], ["FU", 5, [0, 1, 2]], ["AN", 5, 0, 5], ["FU", 5, [1, 2, 3]], ["AN", 5, 1, 4], ["FU", 5, [2, 3, 4]], ["AN", 5, 2, 6], ["FU", 3, [0, 1, 2]], ["SP", 3, 0, 96, [4], 1], ["AN", 3, 1, 2], ["FFSP", 3, 0, [3, 2, 1], 1, 1], ["AN", 3, 1, 6], ["FU", 1, [0, 1, 2]], ["SP", 1, 0, 12, [4], 1], ["AN", 1, 1, 2], ["FFSP", 1, 0, [3, 2, 1], 1, 1], ["AN", 1, 1, 6], ["TBS"], ["SPC", 3, 0, 96, [4], 1], ["SPC", 1, 0, 12, [4], 1], ["PRS", [4]], ["PR", 4, 0, "auto_unroll_max_step$0"]]]], "r": [[0.00011601], 0, 1.57818, 1763447666], "v": "v0.6"}
{"i": [["[\"3ed6b8b696d74a428d188b1a05553246\", [1, 128, 768], [1, 768, 3072], [1, 128, 3072]]", "cuda -keys=cuda,gpu -arch=sm_89 -max_num_threads=1024 -max_shared_memory_per_block=49152 -max_threads_per_block=1024 -registers_per_block=65536 -thread_warp_size=32", [-1, 16, 64, 49152, 12345678, 1024, 8, 32], "", 0, []], [[], [["CHW", 2, "local"], ["SP", 2, 0, 1, [1, 1, 1, 1], 1], ["SP", 2, 5, 128, [2, 32, 2, 1], 1], ["SP", 2, 10, 3072, [2, 1, 1, 16], 1], ["SP", 2, 15, 768, [2, 1], 1], ["RE", 2, [0, 5, 10, 1, 6, 11, 2, 7, 12, 15, 16, 3, 8, 13, 17, 4, 9, 14]], ["FSP", 3, 0, 1, 3], ["FSP", 3, 4, 2, 3], ["FSP", 3, 8, 3, 3], ["RE", 3, [0, 4, 8, 1, 5, 9, 2, 6, 10, 3, 7, 11]], ["CA", 2, 3, 8], ["CHR", 1, "shared", [2]], ["CA", 2, 3, 9], ["CHR", 0, "shared", [3]], ["CA", 1, 4, 9], ["PPT"], ["SPC", 2, 0, 1, [1, 1, 1, 1], 1], ["SPC", 2, 5, 128, [2, 32, 2, 1], 1], ["SPC", 2, 10, 3072, [2, 1, 1, 16], 1], ["SPC", 2, 15, 768, [2, 1], 1], ["FU", 5, [0, 1, 2]], ["AN", 5, 0, 5], ["FU", 5, [1, 2, 3]], ["AN", 5, 1, 4], ["FU", 5, [2, 3, 4]], ["AN", 5, 2, 6], ["FU", 3, [0, 1, 2]], ["SP", 3, 0, 32, [4], 1], ["AN", 3, 1, 2], ["FFSP", 3, 0, [3, 2, 1], 1, 1], ["AN", 3, 1, 6], ["FU", 1, [0, 1, 2]], ["SP", 1, 0, 4, [1], 1], ["AN", 1, 1, 2], ["FFSP", 1, 0, [3, 2, 1], 1, 1], ["AN", 1, 1, 6], ["TBS"], ["SPC", 3, 0, 32, [4], 1], ["SPC", 1, 0, 4, [1], 1], ["PRS", [4]], ["PR", 4, 0, "auto_unroll_max_step$16"]]]], "r": [[0.000166683], 0, 1.56639, 1763447667], "v": "v0.6"}
{"i": [["[\"3ed6b8b696d74a428d188b1a05553246\", [1, 128, 768], [1, 768, 3072], [1, 128, 3072]]", "cuda -keys=cuda,gpu -arch=sm_89 -max_num_threads=1024 -max_shared_memory_per_block=49152 -max_threads_per_block=1024 -registers_per_block=65536 -thread_warp_size=32", [-1, 16, 64, 49152, 12345678, 1024, 8, 32], "", 0, []], [[], [["CHW", 2, "local"], ["SP", 2, 0, 1, [1, 1, 1, 1], 1], ["SP", 2, 5, 128, [1, 64, 1, 2], 1], ["SP", 2, 10, 3072, [2, 1, 1, 8], 1], ["SP", 2, 15, 768, [3, 2], 1], ["RE", 2, [0, 5, 10, 1, 6, 11, 2, 7, 12, 15, 16, 3, 8, 13, 17, 4, 9, 14]], ["FSP", 3, 0, 1, 3], ["FSP", 3, 4, 2, 3], ["FSP", 3, 8, 3, 3], ["RE", 3, [0, 4, 8, 1, 5, 9, 2, 6, 10, 3, 7, 11]], ["CA", 2, 3, 8], ["CHR", 1, "shared", [2]], ["CA", 2, 3, 9], ["CHR", 0, "shared", [3]], ["CA", 1, 4, 9], ["PPT"], ["SPC", 2, 0, 1, [1, 1, 1, 1], 1], ["SPC", 2, 5, 128, [1, 64, 1, 2], 1], ["SPC", 2, 10, 3072, [2, 1, 1, 8], 1], ["SPC", 2, 15, 768, [3, 2], 1], ["FU", 5, [0, 1, 2]], ["AN", 5, 0, 5], ["FU", 5, [1, 2, 3]], ["AN", 5, 1, 4], ["FU", 5, [2, 3, 4]], ["AN", 5, 2, 6], ["FU", 3, [0, 1, 2]], ["SP", 3, 0, 48, [1], 1], ["AN", 3, 1, 2], ["FFSP", 3, 0, [3, 2, 1], 1, 1], ["AN", 3, 1, 6], ["FU", 1, [0, 1, 2]], ["SP", 1, 0, 12, [1], 1], ["AN", 1, 1, 2], ["FFSP", 1, 0, [3, 2, 1], 1, 1], ["AN", 1, 1, 6], ["TBS"], ["SPC", 3, 0, 48, [1], 1], ["SPC", 1, 0, 12, [1], 1], ["PRS", [4]], ["PR", 4, 0, "auto_unroll_max_step$64"]]]], "r": [[7.13201e-05], 0, 1.57323, 1763447668], "v": "v0.6"}
{"i": [["[\"3ed6b8b696d74a428d188b1a05553246\", [1, 128, 768], [1, 768, 3072], [1, 128, 3072]]", "cuda -keys=cuda,gpu -arch=sm_89 -max_num_threads=1024 -max_shared_memory_per_block=49152 -max_threads_per_block=1024 -registers_per_block=65536 -thread_warp_size=32", [-1, 16, 64, 49152, 12345678, 1024, 8, 32], "", 0, []], [[], [["CHW", 2, "local"], ["SP", 2, 0, 1, [1, 1, 1, 1], 1], ["SP", 2, 5, 128, [1, 2, 4, 1], 1], ["SP", 2, 10, 3072, [2, 32, 1, 3], 1], ["SP", 2, 15, 768, [6, 1], 1], ["RE", 2, [0, 5, 10, 1, 6, 11, 2, 7, 12, 15, 16, 3, 8, 13, 17, 4, 9, 14]], ["FSP", 3, 0, 1, 3], ["FSP", 3, 4, 2, 3], ["FSP", 3, 8, 3, 3], ["RE", 3, [0, 4, 8, 1, 5, 9, 2, 6, 10, 3, 7, 11]], ["CA", 2, 3, 8], ["CHR", 1, "shared", [2]], ["CA", 2, 3, 9], ["CHR", 0, "shared", [3]], ["CA", 1, 4, 9], ["PPT"], ["SPC", 2, 0, 1, [1, 1, 1, 1], 1], ["SPC", 2, 5, 128, [1, 2, 4, 1], 1], ["SPC", 2, 10, 3072, [2, 32, 1, 3], 1], ["SPC", 2, 15, 768, [6, 1], 1], ["FU", 5, [0, 1, 2]], ["AN", 5, 0, 5], ["FU", 5, [1, 2, 3]], ["AN", 5, 1, 4], ["FU", 5, [2, 3, 4]], ["AN", 5, 2, 6], ["FU", 3, [0, 1, 2]], ["SP", 3, 0, 18, [2], 1], ["AN", 3, 1, 2], ["FFSP", 3, 0, [3, 2, 1], 1, 1], ["AN", 3, 1, 6], ["FU", 1, [0, 1, 2]], ["SP", 1, 0, 24, [1], 1], ["AN", 1, 1, 2], ["FFSP", 1, 0, [3, 2, 1], 1, 1], ["AN", 1, 1, 6], ["TBS"], ["SPC", 3, 0, 18, [2], 1], ["SPC", 1, 0, 24, [1], 1], ["PRS", [4]], ["PR", 4, 0, "auto_unroll_max_step$512"]]]], "r": [[5.0449e-05], 0, 1.64185, 1763447669], "v": "v0.6"}
{"i": [["[\"3ed6b8b696d74a428d188b1a05553246\", [1, 128, 768], [1, 768, 3072], [1, 128, 3072]]", "cuda -keys=cuda,gpu -arch=sm_89 -max_num_threads=1024 -max_shared_memory_per_block=49152 -max_threads_per_block=1024 -registers_per_block=65536 -thread_warp_size=32", [-1, 16, 64, 49152, 12345678, 1024, 8, 32], "", 0, []], [[], [["CHW", 2, "local"], ["SP", 2, 0, 1, [1, 1, 1, 1], 1], ["SP", 2, 5, 128, [2, 32, 2, 1], 1], ["SP", 2, 10, 3072, [2, 1, 4, 3], 1], ["SP", 2, 15, 768, [1, 32], 1], ["RE", 2, [0, 5, 10, 1, 6, 11, 2, 7, 12, 15, 16, 3, 8, 13, 17, 4, 9, 14]], ["FSP", 3, 0, 1, 3], ["FSP", 3, 4, 2, 3], ["FSP", 3, 8, 3, 3], ["RE", 3, [0, 4, 8, 1, 5, 9, 2, 6, 10, 3, 7, 11]], ["CA", 2, 3, 8], ["CHR", 1, "shared", [2]], ["CA", 2, 3, 9], ["CHR", 0, "shared", [3]], ["CA", 1, 4, 9], ["PPT"], ["SPC", 2, 0, 1, [1, 1, 1, 1], 1], ["SPC", 2, 5, 128, [2, 32, 2, 1], 1], ["SPC", 2, 10, 3072, [2, 1, 4, 3], 1], ["SPC", 2, 15, 768, [1, 32], 1], ["FU", 5, [0, 1, 2]], ["AN", 5, 0, 5], ["FU", 5, [1, 2, 3]], ["AN", 5, 1, 4], ["FU", 5, [2, 3, 4]], ["AN", 5, 2, 6], ["FU", 3, [0, 1, 2]], ["SP", 3, 0, 384, [1], 1], ["AN", 3, 1, 2], ["FFSP", 3, 0, [3, 2, 1], 1, 1], ["AN", 3, 1, 6], ["FU", 1, [0, 1, 2]], ["SP", 1, 0, 64, [1], 1], ["AN", 1, 1, 2], ["FFSP", 1, 0, [3, 2, 1], 1, 1], ["AN", 1, 1, 6], ["TBS"], ["SPC", 3, 0, 384, [1], 1], ["SPC", 1, 0, 64, [1], 1], ["PRS", [4]], ["PR", 4, 0, "auto_unroll_max_step$64"]]]], "r": [[8.61538e-05], 0, 2.06757, 1763447669], "v": "v0.6"}
{"i": [["[\"3ed6b8b696d74a428d188b1a05553246\", [1, 128, 768], [1, 768, 3072], [1, 128, 3072]]", "cuda -keys=cuda,gpu -arch=sm_89 -max_num_threads=1024 -max_shared_memory_per_block=49152 -max_threads_per_block=1024 -registers_per_block=65536 -thread_warp_size=32", [-1, 16, 64, 49152, 12345678, 1024, 8, 32], "", 0, []], [[], [["CHW", 2, "local"], ["SP", 2, 0, 1, [1, 1, 1, 1], 1], ["SP", 2, 5, 128, [2, 4, 1, 2], 1], ["SP", 2, 10, 3072, [1, 32, 1, 1], 1], ["SP", 2, 15, 768, [1, 3], 1], ["RE", 2, [0, 5, 10, 1, 6, 11, 2, 7, 12, 15, 16, 3, 8, 13, 17, 4, 9, 14]], ["FSP", 3, 0, 1, 3], ["FSP", 3, 4, 2, 3], ["FSP", 3, 8, 3, 3], ["RE", 3, [0, 4, 8, 1, 5, 9, 2, 6, 10, 3, 7, 11]], ["CA", 2, 3, 8], ["CHR", 1, "shared", [2]], ["CA", 2, 3, 9], ["CHR", 0, "shared", [3]], ["CA", 1, 4, 9], ["PPT"], ["SPC", 2, 0, 1, [1, 1, 1, 1], 1], ["SPC", 2, 5, 128, [2, 4, 1, 2], 1], ["SPC", 2, 10, 3072, [1, 32, 1, 1], 1], ["SPC", 2, 15, 768, [1, 3], 1], ["FU", 5, [0, 1, 2]], ["AN", 5, 0, 5], ["FU", 5, [1, 2, 3]], ["AN", 5, 1, 4], ["FU", 5, [2, 3, 4]], ["AN", 5, 2, 6], ["FU", 3, [0, 1, 2]], ["SP", 3, 0, 3, [1], 1], ["AN", 3, 1, 2], ["FFSP", 3, 0, [3, 2, 1], 1, 1], ["AN", 3, 1, 6], ["FU", 1, [0, 1, 2]], ["SP", 1, 0, 6, [1], 1], ["AN", 1, 1, 2], ["FFSP", 1, 0, [3, 2, 1], 1, 1], ["AN", 1, 1, 6], ["TBS"], ["SPC", 3, 0, 3, [1], 1], ["SPC", 1, 0, 6, [1], 1], ["PRS", [4]], ["PR", 4, 0, "auto_unroll_max_step$512"]]]], "r": [[7.24194e-05], 0, 1.3283, 1763447670], "v": "v0.6"}
{"i": [["[\"3ed6b8b696d74a428d188b1a05553246\", [1, 128, 768], [1, 768, 3072], [1, 128, 3072]]", "cuda -keys=cuda,gpu -arch=sm_89 -max_num_threads=1024 -max_shared_memory_per_block=49152 -max_threads_per_block=1024 -registers_per_block=65536 -thread_warp_size=32", [-1, 16, 64, 49152, 12345678, 1024, 8, 32], "", 0, []], [[], [["CHW", 2, "local"], ["SP", 2, 0, 1, [1, 1, 1, 1], 1], ["SP", 2, 5, 128, [2, 64, 1, 1], 1], ["SP", 2, 10, 3072, [2, 1, 1, 4], 1], ["SP", 2, 15, 768, [4, 1], 1], ["RE", 2, [0, 5, 10, 1, 6, 11, 2, 7, 12, 15, 16, 3, 8, 13, 17, 4, 9, 14]], ["FSP", 3, 0, 1, 3], ["FSP", 3, 4, 2, 3], ["FSP", 3, 8, 3, 3], ["RE", 3, [0, 4, 8, 1, 5, 9, 2, 6, 10, 3, 7, 11]], ["CA", 2, 3, 8], ["CHR", 1, "shared", [2]], ["CA", 2, 3, 9], ["CHR", 0, "shared", [3]], ["CA", 1, 4, 9], ["PPT"], ["SPC", 2, 0, 1, [1, 1, 1, 1], 1], ["SPC", 2, 5, 128, [2, 64, 1, 1], 1], ["SPC", 2, 10, 3072, [2, 1, 1, 4], 1], ["SPC", 2, 15, 768, [4, 1], 1], ["FU", 5, [0, 1, 2]], ["AN", 5, 0, 5], ["FU", 5, [1, 2, 3]], ["AN", 5, 1, 4], ["FU", 5, [2, 3, 4]], ["AN", 5, 2, 6], ["FU", 3, [0, 1, 2]], ["SP", 3, 0, 16, [1], 1], ["AN", 3, 1, 2], ["FFSP", 3, 0, [3, 2, 1], 1, 1], ["AN", 3, 1, 6], ["FU", 1, [0, 1, 2]], ["SP", 1, 0, 4, [2], 1], ["AN", 1, 1, 2], ["FFSP", 1, 0, [3, 2, 1], 1, 1], ["AN", 1, 1, 6], ["TBS"], ["SPC", 3, 0, 16, [1], 1], ["SPC", 1, 0, 4, [2], 1], ["PRS", [4]], ["PR", 4, 0, "auto_unroll_max_step$16"]]]], "r": [[7.26259e-05], 0, 1.46375, 1763447671], "v": "v0.6"}
{"i": [["[\"3ed6b8b696d74a428d188b1a05553246\", [1, 128, 768], [1, 768, 3072], [1, 128, 3072]]", "cuda -keys=cuda,gpu -arch=sm_89 -max_num_threads=1024 -max_shared_memory_per_block=49152 -max_threads_per_block=1024 -registers_per_block=65536 -thread_warp_size=32", [-1, 16, 64, 49152, 12345678, 1024, 8, 32], "", 0, []], [[], [["CHW", 2, "local"], ["SP", 2, 0, 1, [1, 1, 1, 1], 1], ["SP", 2, 5, 128, [2, 1, 1, 1], 1], ["SP", 2, 10, 3072, [2, 64, 1, 1], 1], ["SP", 2, 15, 768, [1, 64], 1], ["RE", 2, [0, 5, 10, 1, 6, 11, 2, 7, 12, 15, 16, 3, 8, 13, 17, 4, 9, 14]], ["FSP", 3, 0, 1, 3], ["FSP", 3, 4, 2, 3], ["FSP", 3, 8, 3, 3], ["RE", 3, [0, 4, 8, 1, 5, 9, 2, 6, 10, 3, 7, 11]], ["CA", 2, 3, 8], ["CHR", 1, "shared", [2]], ["CA", 2, 3, 9], ["CHR", 0, "shared", [3]], ["CA", 1, 4, 9], ["PPT"], ["SPC", 2, 0, 1, [1, 1, 1, 1], 1], ["SPC", 2, 5, 128, [2, 1, 1, 1], 1], ["SPC", 2, 10, 3072, [2, 64, 1, 1], 1], ["SPC", 2, 15, 768, [1, 64], 1], ["FU", 5, [0, 1, 2]], ["AN", 5, 0, 5], ["FU", 5, [1, 2, 3]], ["AN", 5, 1, 4], ["FU", 5, [2, 3, 4]], ["AN", 5, 2, 6], ["FU", 3, [0, 1, 2]], ["SP", 3, 0, 64, [4], 1], ["AN", 3, 1, 2], ["FFSP", 3, 0, [3, 2, 1], 1, 1], ["AN", 3, 1, 6], ["FU", 1, [0, 1, 2]], ["SP", 1, 0, 64, [1], 1], ["AN", 1, 1, 2], ["FFSP", 1, 0, [3, 2, 1], 1, 1], ["AN", 1, 1, 6], ["TBS"], ["SPC", 3, 0, 64, [4], 1], ["SPC", 1, 0, 64, [1], 1], ["PRS", [4]], ["PR", 4, 0, "auto_unroll_max_step$1024"]]]], "r": [[0.000128661], 0, 1.87116, 1763447672], "v": "v0.6"}
{"i": [["[\"3ed6b8b696d74a428d188b1a05553246\", [1, 128, 768], [1, 768, 3072], [1, 128, 3072]]", "cuda -keys=cuda,gpu -arch=sm_89 -max_num_threads=1024 -max_shared_memory_per_block=49152 -max_threads_per_block=1024 -registers_per_block=65536 -thread_warp_size=32", [-1, 16, 64, 49152, 12345678, 1024, 8, 32], "", 0, []], [[], [["CHW", 2, "local"], ["SP", 2, 0, 1, [1, 1, 1, 1], 1], ["SP", 2, 5, 128, [1, 8, 1, 1], 1], ["SP", 2, 10, 3072, [4, 32, 4, 1], 1], ["SP", 2, 15, 768, [6, 1], 1], ["RE", 2, [0, 5, 10, 1, 6, 11, 2, 7, 12, 15, 16, 3, 8, 13, 17, 4, 9, 14]], ["FSP", 3, 0, 1, 3], ["FSP", 3, 4, 2, 3], ["FSP", 3, 8, 3, 3], ["RE", 3, [0, 4, 8, 1, 5, 9, 2, 6, 10, 3, 7, 11]], ["CA", 2, 3, 8], ["CHR", 1, "shared", [2]], ["CA", 2, 3, 9], ["CHR", 0, "shared", [3]], ["CA", 1, 4, 9], ["PPT"], ["SPC", 2, 0, 1, [1, 1, 1, 1], 1], ["SPC", 2, 5, 128, [1, 8, 1, 1], 1], ["SPC", 2, 10, 3072, [4, 32, 4, 1], 1], ["SPC", 2, 15, 768, [6, 1], 1], ["FU", 5, [0, 1, 2]], ["AN", 5, 0, 5], ["FU", 5, [1, 2, 3]], ["AN", 5, 1, 4], ["FU", 5, [2, 3, 4]], ["AN", 5, 2, 6], ["FU", 3, [0, 1, 2]], ["SP", 3, 0, 24, [2], 1], ["AN", 3, 1, 2], ["FFSP", 3, 0, [3, 2, 1], 1, 1], ["AN", 3, 1, 6], ["FU", 1, [0, 1, 2]], ["SP", 1, 0, 6, [2], 1], ["AN", 1, 1, 2], ["FFSP", 1, 0, [3, 2, 1], 1, 1], ["AN", 1, 1, 6], ["TBS"], ["SPC", 3, 0, 24, [2], 1], ["SPC", 1, 0, 6, [2], 1], ["PRS", [4]], ["PR", 4, 0, "auto_unroll_max_step$1024"]]]], "r": [[8.2689e-05], 0, 1.6105, 1763447673], "v": "v0.6"}
{"i": [["[\"3ed6b8b696d74a428d188b1a05553246\", [1, 128, 768], [1, 768, 3072], [1, 128, 3072]]", "cuda -keys=cuda,gpu -arch=sm_89 -max_num_threads=1024 -max_shared_memory_per_block=49152 -max_threads_per_block=1024 -registers_per_block=65536 -thread_warp_size=32", [-1, 16, 64, 49152, 12345678, 1024, 8, 32], "", 0, []], [[], [["CHW", 2, "local"], ["SP", 2, 0, 1, [1, 1, 1, 1], 1], ["SP", 2, 5, 128, [2, 1, 1, 2], 1], ["SP", 2, 10, 3072, [1, 48, 1, 1], 1], ["SP", 2, 15, 768, [6, 1], 1], ["RE", 2, [0, 5, 10, 1, 6, 11, 2, 7, 12, 15, 16, 3, 8, 13, 17, 4, 9, 14]], ["FSP", 3, 0, 1, 3], ["FSP", 3, 4, 2, 3], ["FSP", 3, 8, 3, 3], ["RE", 3, [0, 4, 8, 1, 5, 9, 2, 6, 10, 3, 7, 11]], ["CA", 2, 3, 8], ["CHR", 1, "shared", [2]], ["CA", 2, 3, 9], ["CHR", 0, "shared", [3]], ["CA", 1, 4, 9], ["PPT"], ["SPC", 2, 0, 1, [1, 1, 1, 1], 1], ["SPC", 2, 5, 128, [2, 1, 1, 2], 1], ["SPC", 2, 10, 3072, [1, 48, 1, 1], 1], ["SPC", 2, 15, 768, [6, 1], 1], ["FU", 5, [0, 1, 2]], ["AN", 5, 0, 5], ["FU", 5, [1, 2, 3]], ["AN", 5, 1, 4], ["FU", 5, [2, 3, 4]], ["AN", 5, 2, 6], ["FU", 3, [0, 1, 2]], ["SP", 3, 0, 6, [3], 1], ["AN", 3, 1, 2], ["FFSP", 3, 0, [3, 2, 1], 1, 1], ["AN", 3, 1, 6], ["FU", 1, [0, 1, 2]], ["SP", 1, 0, 12, [1], 1], ["AN", 1, 1, 2], ["FFSP", 1, 0, [3, 2, 1], 1, 1], ["AN", 1, 1, 6], ["TBS"], ["SPC", 3, 0, 6, [3], 1], ["SPC", 1, 0, 12, [1], 1], ["PRS", [4]], ["PR", 4, 0, "auto_unroll_max_step$512"]]]], "r": [[8.93372e-05], 0, 1.36979, 1763447674], "v": "v0.6"}
{"i": [["[\"3ed6b8b696d74a428d188b1a05553246\", [1, 128, 768], [1, 768, 3072], [1, 128, 3072]]", "cuda -keys=cuda,gpu -arch=sm_89 -max_num_threads=1024 -max_shared_memory_per_block=49152 -max_threads_per_block=1024 -registers_per_block=65536 -thread_warp_size=32", [-1, 16, 64, 49152, 12345678, 1024, 8, 32], "", 0, []], [[], [["CHW", 2, "local"], ["SP", 2, 0, 1, [1, 1, 1, 1], 1], ["SP", 2, 5, 128, [4, 1, 1, 4], 1], ["SP", 2, 10, 3072, [1, 48, 4, 1], 1], ["SP", 2, 15, 768, [2, 2], 1], ["RE", 2, [0, 5, 10, 1, 6, 11, 2, 7, 12, 15, 16, 3, 8, 13, 17, 4, 9, 14]], ["FSP", 3, 0, 1, 3], ["FSP", 3, 4, 2, 3], ["FSP", 3, 8, 3, 3], ["RE", 3, [0, 4, 8, 1, 5, 9, 2, 6, 10, 3, 7, 11]], ["CA", 2, 3, 8], ["CHR", 1, "shared", [2]], ["CA", 2, 3, 9], ["CHR", 0, "shared", [3]], ["CA", 1, 4, 9], ["PPT"], ["SPC", 2, 0, 1, [1, 1, 1, 1], 1], ["SPC", 2, 5, 128, [4, 1, 1, 4], 1], ["SPC", 2, 10, 3072, [1, 48, 4, 1], 1], ["SPC", 2, 15, 768, [2, 2], 1], ["FU", 5, [0, 1, 2]], ["AN", 5, 0, 5], ["FU", 5, [1, 2, 3]], ["AN", 5, 1, 4], ["FU", 5, [2, 3, 4]], ["AN", 5, 2, 6], ["FU", 3, [0, 1, 2]], ["SP", 3, 0, 16, [1], 1], ["AN", 3, 1, 2], ["FFSP", 3, 0, [3, 2, 1], 1, 1], ["AN", 3, 1, 6], ["FU", 1, [0, 1, 2]], ["SP", 1, 0, 16, [1], 1], ["AN", 1, 1, 2], ["FFSP", 1, 0, [3, 2, 1], 1, 1], ["AN", 1, 1, 6], ["TBS"], ["SPC", 3, 0, 16, [1], 1], ["SPC", 1, 0, 16, [1], 1], ["PRS", [4]], ["PR", 4, 0, "auto_unroll_max_step$64"]]]], "r": [[7.7376e-05], 0, 1.63778, 1763447675], "v": "v0.6"}
{"i": [["[\"3ed6b8b696d74a428d188b1a05553246\", [1, 128, 768], [1, 768, 3072], [1, 128, 3072]]", "cuda -keys=cuda,gpu -arch=sm_89 -max_num_threads=1024 -max_shared_memory_per_block=49152 -max_threads_per_block=1024 -registers_per_block=65536 -thread_warp_size=32", [-1, 16, 64, 49152, 12345678, 1024, 8, 32], "", 0, []], [[], [["CHW", 2, "local"], ["SP", 2, 0, 1, [1, 1, 1, 1], 1], ["SP", 2, 5, 128, [1, 8, 16, 1], 1], ["SP", 2, 10, 3072, [8, 8, 1, 1], 1], ["SP", 2, 15, 768, [48, 1], 1], ["RE", 2, [0, 5, 10, 1, 6, 11, 2, 7, 12, 15, 16, 3, 8, 13, 17, 4, 9, 14]], ["FSP", 3, 0, 1, 3], ["FSP", 3, 4, 2, 3], ["FSP", 3, 8, 3, 3], ["RE", 3, [0, 4, 8, 1, 5, 9, 2, 6, 10, 3, 7, 11]], ["CA", 2, 3, 8], ["CHR", 1, "shared", [2]], ["CA", 2, 3, 9], ["CHR", 0, "shared", [3]], ["CA", 1, 4, 9], ["PPT"], ["SPC", 2, 0, 1, [1, 1, 1, 1], 1], ["SPC", 2, 5, 128, [1, 8, 16, 1], 1], ["SPC", 2, 10, 3072, [8, 8, 1, 1], 1], ["SPC", 2, 15, 768, [48, 1], 1], ["FU", 5, [0, 1, 2]], ["AN", 5, 0, 5], ["FU", 5, [1, 2, 3]], ["AN", 5, 1, 4], ["FU", 5, [2, 3, 4]], ["AN", 5, 2, 6], ["FU", 3, [0, 1, 2]], ["SP", 3, 0, 48, [8], 1], ["AN", 3, 1, 2], ["FFSP", 3, 0, [3, 2, 1], 1, 1], ["AN", 3, 1, 6], ["FU", 1, [0, 1, 2]], ["SP", 1, 0, 768, [1], 1], ["AN", 1, 1, 2], ["FFSP", 1, 0, [3, 2, 1], 1, 1], ["AN", 1, 1, 6], ["TBS"], ["SPC", 3, 0, 48, [8], 1], ["SPC", 1, 0, 768, [1], 1], ["PRS", [4]], ["PR", 4, 0, "auto_unroll_max_step$512"]]]], "r": [[8.31215e-05], 0, 2.2312, 1763447676], "v": "v0.6"}
{"i": [["[\"3ed6b8b696d74a428d188b1a05553246\", [1, 128, 768], [1, 768, 3072], [1, 128, 3072]]", "cuda -keys=cuda,gpu -arch=sm_89 -max_num_threads=1024 -max_shared_memory_per_block=49152 -max_threads_per_block=1024 -registers_per_block=65536 -thread_warp_size=32", [-1, 16, 64, 49152, 12345678, 1024, 8, 32], "", 0, []], [[], [["CHW", 2, "local"], ["SP", 2, 0, 1, [1, 1, 1, 1], 1], ["SP", 2, 5, 128, [1, 32, 4, 1], 1], ["SP", 2, 10, 3072, [4, 1, 1, 384], 1], ["SP", 2, 15, 768, [2, 1], 1], ["RE", 2, [0, 5, 10, 1, 6, 11, 2, 7, 12, 15, 16, 3, 8, 13, 17, 4, 9, 14]], ["FSP", 3, 0, 1, 3], ["FSP", 3, 4, 2, 3], ["FSP", 3, 8, 3, 3], ["RE", 3, [0, 4, 8, 1, 5, 9, 2, 6, 10, 3, 7, 11]], ["CA", 2, 3, 8], ["CHR", 1, "shared", [2]], ["CA", 2, 3, 9], ["CHR", 0, "shared", [3]], ["CA", 1, 4, 9], ["PPT"], ["SPC", 2, 0, 1, [1, 1, 1, 1], 1], ["SPC", 2, 5, 128, [1, 32, 4, 1], 1], ["SPC", 2, 10, 3072, [4, 1, 1, 384], 1], ["SPC", 2, 15, 768, [2, 1], 1], ["FU", 5, [0, 1, 2]], ["AN", 5, 0, 5], ["FU", 5, [1, 2, 3]], ["AN", 5, 1, 4], ["FU", 5, [2, 3, 4]], ["AN", 5, 2, 6], ["FU", 3, [0, 1, 2]], ["SP", 3, 0, 768, [2], 1], ["AN", 3, 1, 2], ["FFSP", 3, 0, [3, 2, 1], 1, 1], ["AN", 3, 1, 6], ["FU", 1, [0, 1, 2]], ["SP", 1, 0, 8, [2], 1], ["AN", 1, 1, 2], ["FFSP", 1, 0, [3, 2, 1], 1, 1], ["AN", 1, 1, 6], ["TBS"], ["SPC", 3, 0, 768, [2], 1], ["SPC", 1, 0, 8, [2], 1], ["PRS", [4]], ["PR", 4, 0, "auto_unroll_max_step$64"]]]], "r": [[0.0204281], 0, 7.69874, 1763447676], "v": "v0.6"}
